Data,DiaCol,Vazao,Dia,DataMes,DataCompleta,Ano,Mes,Evento
01/03/1934,Vazao01,,1,1934-03-01,1934-03-01,1934,3,Normal
01/03/1934,Vazao02,,2,1934-03-01,1934-03-02,1934,3,Normal
01/03/1934,Vazao03,,3,1934-03-01,1934-03-03,1934,3,Normal
01/03/1934,Vazao04,,4,1934-03-01,1934-03-04,1934,3,Normal
01/03/1934,Vazao05,,5,1934-03-01,1934-03-05,1934,3,Normal
01/03/1934,Vazao06,,6,1934-03-01,1934-03-06,1934,3,Normal
01/03/1934,Vazao07,,7,1934-03-01,1934-03-07,1934,3,Normal
01/03/1934,Vazao08,20.9584,8,1934-03-01,1934-03-08,1934,3,Normal
01/03/1934,Vazao09,18.7225,9,1934-03-01,1934-03-09,1934,3,Normal
01/03/1934,Vazao10,17.4264,10,1934-03-01,1934-03-10,1934,3,Normal
01/03/1934,Vazao11,17.002,11,1934-03-01,1934-03-11,1934,3,Normal
01/03/1934,Vazao12,16.165,12,1934-03-01,1934-03-12,1934,3,Normal
01/03/1934,Vazao13,16.165,13,1934-03-01,1934-03-13,1934,3,Normal
01/03/1934,Vazao14,17.4264,14,1934-03-01,1934-03-14,1934,3,Normal
01/03/1934,Vazao15,18.2866,15,1934-03-01,1934-03-15,1934,3,Normal
01/03/1934,Vazao16,18.7225,16,1934-03-01,1934-03-16,1934,3,Normal
01/03/1934,Vazao17,20.0528,17,1934-03-01,1934-03-17,1934,3,Normal
01/03/1934,Vazao18,18.7225,18,1934-03-01,1934-03-18,1934,3,Normal
01/03/1934,Vazao19,25.2138,19,1934-03-01,1934-03-19,1934,3,Normal
01/03/1934,Vazao20,28.2099,20,1934-03-01,1934-03-20,1934,3,Normal
01/03/1934,Vazao21,34.568,21,1934-03-01,1934-03-21,1934,3,Normal
01/03/1934,Vazao22,23.2865,22,1934-03-01,1934-03-22,1934,3,Normal
01/03/1934,Vazao23,23.2865,23,1934-03-01,1934-03-23,1934,3,Normal
01/03/1934,Vazao24,30.8008,24,1934-03-01,1934-03-24,1934,3,Normal
01/03/1934,Vazao25,34.568,25,1934-03-01,1934-03-25,1934,3,Normal
01/03/1934,Vazao26,29.7543,26,1934-03-01,1934-03-26,1934,3,Normal
01/03/1934,Vazao27,27.1974,27,1934-03-01,1934-03-27,1934,3,Normal
01/03/1934,Vazao28,19.6056,28,1934-03-01,1934-03-28,1934,3,Normal
01/03/1934,Vazao29,17.002,29,1934-03-01,1934-03-29,1934,3,Normal
01/03/1934,Vazao30,17.002,30,1934-03-01,1934-03-30,1934,3,Normal
01/03/1934,Vazao31,15.7525,31,1934-03-01,1934-03-31,1934,3,Normal
01/04/1934,Vazao01,15.3439,1,1934-04-01,1934-04-01,1934,4,Normal
01/04/1934,Vazao02,15.3439,2,1934-04-01,1934-04-02,1934,4,Normal
01/04/1934,Vazao03,14.1421,3,1934-04-01,1934-04-03,1934,4,Normal
01/04/1934,Vazao04,14.1421,4,1934-04-01,1934-04-04,1934,4,Normal
01/04/1934,Vazao05,13.7497,5,1934-04-01,1934-04-05,1934,4,Normal
01/04/1934,Vazao06,13.3614,6,1934-04-01,1934-04-06,1934,4,Normal
01/04/1934,Vazao07,12.9772,7,1934-04-01,1934-04-07,1934,4,Normal
01/04/1934,Vazao08,12.9772,8,1934-04-01,1934-04-08,1934,4,Normal
01/04/1934,Vazao09,12.2214,9,1934-04-01,1934-04-09,1934,4,Normal
01/04/1934,Vazao10,12.5972,10,1934-04-01,1934-04-10,1934,4,Normal
01/04/1934,Vazao11,12.2214,11,1934-04-01,1934-04-11,1934,4,Normal
01/04/1934,Vazao12,13.3614,12,1934-04-01,1934-04-12,1934,4,Normal
01/04/1934,Vazao13,19.1622,13,1934-04-01,1934-04-13,1934,4,Normal
01/04/1934,Vazao14,15.7525,14,1934-04-01,1934-04-14,1934,4,Normal
01/04/1934,Vazao15,15.7525,15,1934-04-01,1934-04-15,1934,4,Normal
01/04/1934,Vazao16,13.3614,16,1934-04-01,1934-04-16,1934,4,Normal
01/04/1934,Vazao17,12.2214,17,1934-04-01,1934-04-17,1934,4,Normal
01/04/1934,Vazao18,14.9393,18,1934-04-01,1934-04-18,1934,4,Normal
01/04/1934,Vazao19,12.5972,19,1934-04-01,1934-04-19,1934,4,Normal
01/04/1934,Vazao20,12.9772,20,1934-04-01,1934-04-20,1934,4,Normal
01/04/1934,Vazao21,11.8498,21,1934-04-01,1934-04-21,1934,4,Normal
01/04/1934,Vazao22,11.8498,22,1934-04-01,1934-04-22,1934,4,Normal
01/04/1934,Vazao23,11.8498,23,1934-04-01,1934-04-23,1934,4,Normal
01/04/1934,Vazao24,17.002,24,1934-04-01,1934-04-24,1934,4,Normal
01/04/1934,Vazao25,12.2214,25,1934-04-01,1934-04-25,1934,4,Normal
01/04/1934,Vazao26,11.1195,26,1934-04-01,1934-04-26,1934,4,Normal
01/04/1934,Vazao27,11.8498,27,1934-04-01,1934-04-27,1934,4,Normal
01/04/1934,Vazao28,13.3614,28,1934-04-01,1934-04-28,1934,4,Normal
01/04/1934,Vazao29,11.8498,29,1934-04-01,1934-04-29,1934,4,Normal
01/04/1934,Vazao30,12.2214,30,1934-04-01,1934-04-30,1934,4,Normal
01/05/1934,Vazao01,11.4825,1,1934-05-01,1934-05-01,1934,5,Normal
01/05/1934,Vazao02,11.1195,2,1934-05-01,1934-05-02,1934,5,Normal
01/05/1934,Vazao03,10.4066,3,1934-05-01,1934-05-03,1934,5,Normal
01/05/1934,Vazao04,10.4066,4,1934-05-01,1934-05-04,1934,5,Normal
01/05/1934,Vazao05,9.7114,5,1934-05-01,1934-05-05,1934,5,Normal
01/05/1934,Vazao06,9.0342,6,1934-05-01,1934-05-06,1934,5,Normal
01/05/1934,Vazao07,9.0342,7,1934-05-01,1934-05-07,1934,5,Normal
01/05/1934,Vazao08,8.7024,8,1934-05-01,1934-05-08,1934,5,Normal
01/05/1934,Vazao09,8.3753,9,1934-05-01,1934-05-09,1934,5,Seca
01/05/1934,Vazao10,8.7024,10,1934-05-01,1934-05-10,1934,5,Normal
01/05/1934,Vazao11,8.7024,11,1934-05-01,1934-05-11,1934,5,Normal
01/05/1934,Vazao12,8.7024,12,1934-05-01,1934-05-12,1934,5,Normal
01/05/1934,Vazao13,8.7024,13,1934-05-01,1934-05-13,1934,5,Normal
01/05/1934,Vazao14,8.3753,14,1934-05-01,1934-05-14,1934,5,Seca
01/05/1934,Vazao15,8.0529,15,1934-05-01,1934-05-15,1934,5,Seca
01/05/1934,Vazao16,7.7351,16,1934-05-01,1934-05-16,1934,5,Seca
01/05/1934,Vazao17,7.7351,17,1934-05-01,1934-05-17,1934,5,Seca
01/05/1934,Vazao18,7.7351,18,1934-05-01,1934-05-18,1934,5,Seca
01/05/1934,Vazao19,7.7351,19,1934-05-01,1934-05-19,1934,5,Seca
01/05/1934,Vazao20,7.7351,20,1934-05-01,1934-05-20,1934,5,Seca
01/05/1934,Vazao21,7.7351,21,1934-05-01,1934-05-21,1934,5,Seca
01/05/1934,Vazao22,7.114,22,1934-05-01,1934-05-22,1934,5,Seca
01/05/1934,Vazao23,6.8108,23,1934-05-01,1934-05-23,1934,5,Seca
01/05/1934,Vazao24,6.8108,24,1934-05-01,1934-05-24,1934,5,Seca
01/05/1934,Vazao25,6.8108,25,1934-05-01,1934-05-25,1934,5,Seca
01/05/1934,Vazao26,6.5124,26,1934-05-01,1934-05-26,1934,5,Seca
01/05/1934,Vazao27,6.5124,27,1934-05-01,1934-05-27,1934,5,Seca
01/05/1934,Vazao28,6.2191,28,1934-05-01,1934-05-28,1934,5,Seca
01/05/1934,Vazao29,6.2191,29,1934-05-01,1934-05-29,1934,5,Seca
01/05/1934,Vazao30,5.9308,30,1934-05-01,1934-05-30,1934,5,Seca
01/05/1934,Vazao31,5.9308,31,1934-05-01,1934-05-31,1934,5,Seca
01/06/1934,Vazao01,5.9308,1,1934-06-01,1934-06-01,1934,6,Seca
01/06/1934,Vazao02,5.9308,2,1934-06-01,1934-06-02,1934,6,Seca
01/06/1934,Vazao03,5.9308,3,1934-06-01,1934-06-03,1934,6,Seca
01/06/1934,Vazao04,5.9308,4,1934-06-01,1934-06-04,1934,6,Seca
01/06/1934,Vazao05,5.6476,5,1934-06-01,1934-06-05,1934,6,Seca
01/06/1934,Vazao06,5.6476,6,1934-06-01,1934-06-06,1934,6,Seca
01/06/1934,Vazao07,5.3696,7,1934-06-01,1934-06-07,1934,6,Seca
01/06/1934,Vazao08,6.2191,8,1934-06-01,1934-06-08,1934,6,Seca
01/06/1934,Vazao09,6.2191,9,1934-06-01,1934-06-09,1934,6,Seca
01/06/1934,Vazao10,5.9308,10,1934-06-01,1934-06-10,1934,6,Seca
01/06/1934,Vazao11,5.9308,11,1934-06-01,1934-06-11,1934,6,Seca
01/06/1934,Vazao12,5.9308,12,1934-06-01,1934-06-12,1934,6,Seca
01/06/1934,Vazao13,5.6476,13,1934-06-01,1934-06-13,1934,6,Seca
01/06/1934,Vazao14,5.6476,14,1934-06-01,1934-06-14,1934,6,Seca
01/06/1934,Vazao15,5.3696,15,1934-06-01,1934-06-15,1934,6,Seca
01/06/1934,Vazao16,5.3696,16,1934-06-01,1934-06-16,1934,6,Seca
01/06/1934,Vazao17,5.3696,17,1934-06-01,1934-06-17,1934,6,Seca
01/06/1934,Vazao18,5.0968,18,1934-06-01,1934-06-18,1934,6,Seca
01/06/1934,Vazao19,5.0968,19,1934-06-01,1934-06-19,1934,6,Seca
01/06/1934,Vazao20,5.0968,20,1934-06-01,1934-06-20,1934,6,Seca
01/06/1934,Vazao21,5.0968,21,1934-06-01,1934-06-21,1934,6,Seca
01/06/1934,Vazao22,5.0968,22,1934-06-01,1934-06-22,1934,6,Seca
01/06/1934,Vazao23,5.0968,23,1934-06-01,1934-06-23,1934,6,Seca
01/06/1934,Vazao24,5.3696,24,1934-06-01,1934-06-24,1934,6,Seca
01/06/1934,Vazao25,5.6476,25,1934-06-01,1934-06-25,1934,6,Seca
01/06/1934,Vazao26,5.6476,26,1934-06-01,1934-06-26,1934,6,Seca
01/06/1934,Vazao27,5.9308,27,1934-06-01,1934-06-27,1934,6,Seca
01/06/1934,Vazao28,5.9308,28,1934-06-01,1934-06-28,1934,6,Seca
01/06/1934,Vazao29,5.6476,29,1934-06-01,1934-06-29,1934,6,Seca
01/06/1934,Vazao30,5.6476,30,1934-06-01,1934-06-30,1934,6,Seca
01/07/1934,Vazao01,5.9308,1,1934-07-01,1934-07-01,1934,7,Seca
01/07/1934,Vazao02,5.9308,2,1934-07-01,1934-07-02,1934,7,Seca
01/07/1934,Vazao03,7.114,3,1934-07-01,1934-07-03,1934,7,Seca
01/07/1934,Vazao04,7.114,4,1934-07-01,1934-07-04,1934,7,Seca
01/07/1934,Vazao05,7.114,5,1934-07-01,1934-07-05,1934,7,Seca
01/07/1934,Vazao06,7.114,6,1934-07-01,1934-07-06,1934,7,Seca
01/07/1934,Vazao07,6.8108,7,1934-07-01,1934-07-07,1934,7,Seca
01/07/1934,Vazao08,6.8108,8,1934-07-01,1934-07-08,1934,7,Seca
01/07/1934,Vazao09,6.8108,9,1934-07-01,1934-07-09,1934,7,Seca
01/07/1934,Vazao10,6.8108,10,1934-07-01,1934-07-10,1934,7,Seca
01/07/1934,Vazao11,7.114,11,1934-07-01,1934-07-11,1934,7,Seca
01/07/1934,Vazao12,8.0529,12,1934-07-01,1934-07-12,1934,7,Seca
01/07/1934,Vazao13,8.0529,13,1934-07-01,1934-07-13,1934,7,Seca
01/07/1934,Vazao14,8.0529,14,1934-07-01,1934-07-14,1934,7,Seca
01/07/1934,Vazao15,8.0529,15,1934-07-01,1934-07-15,1934,7,Seca
01/07/1934,Vazao16,8.0529,16,1934-07-01,1934-07-16,1934,7,Seca
01/07/1934,Vazao17,8.0529,17,1934-07-01,1934-07-17,1934,7,Seca
01/07/1934,Vazao18,8.0529,18,1934-07-01,1934-07-18,1934,7,Seca
01/07/1934,Vazao19,8.0529,19,1934-07-01,1934-07-19,1934,7,Seca
01/07/1934,Vazao20,7.114,20,1934-07-01,1934-07-20,1934,7,Seca
01/07/1934,Vazao21,7.114,21,1934-07-01,1934-07-21,1934,7,Seca
01/07/1934,Vazao22,7.114,22,1934-07-01,1934-07-22,1934,7,Seca
01/07/1934,Vazao23,7.114,23,1934-07-01,1934-07-23,1934,7,Seca
01/07/1934,Vazao24,7.114,24,1934-07-01,1934-07-24,1934,7,Seca
01/07/1934,Vazao25,7.114,25,1934-07-01,1934-07-25,1934,7,Seca
01/07/1934,Vazao26,7.4222,26,1934-07-01,1934-07-26,1934,7,Seca
01/07/1934,Vazao27,7.7351,27,1934-07-01,1934-07-27,1934,7,Seca
01/07/1934,Vazao28,7.7351,28,1934-07-01,1934-07-28,1934,7,Seca
01/07/1934,Vazao29,7.7351,29,1934-07-01,1934-07-29,1934,7,Seca
01/07/1934,Vazao30,7.4222,30,1934-07-01,1934-07-30,1934,7,Seca
01/07/1934,Vazao31,7.4222,31,1934-07-01,1934-07-31,1934,7,Seca
01/08/1934,Vazao01,7.7351,1,1934-08-01,1934-08-01,1934,8,Seca
01/08/1934,Vazao02,7.7351,2,1934-08-01,1934-08-02,1934,8,Seca
01/08/1934,Vazao03,7.7351,3,1934-08-01,1934-08-03,1934,8,Seca
01/08/1934,Vazao04,7.114,4,1934-08-01,1934-08-04,1934,8,Seca
01/08/1934,Vazao05,7.114,5,1934-08-01,1934-08-05,1934,8,Seca
01/08/1934,Vazao06,7.4222,6,1934-08-01,1934-08-06,1934,8,Seca
01/08/1934,Vazao07,7.4222,7,1934-08-01,1934-08-07,1934,8,Seca
01/08/1934,Vazao08,7.114,8,1934-08-01,1934-08-08,1934,8,Seca
01/08/1934,Vazao09,7.114,9,1934-08-01,1934-08-09,1934,8,Seca
01/08/1934,Vazao10,7.114,10,1934-08-01,1934-08-10,1934,8,Seca
01/08/1934,Vazao11,7.114,11,1934-08-01,1934-08-11,1934,8,Seca
01/08/1934,Vazao12,7.7351,12,1934-08-01,1934-08-12,1934,8,Seca
01/08/1934,Vazao13,7.114,13,1934-08-01,1934-08-13,1934,8,Seca
01/08/1934,Vazao14,7.4222,14,1934-08-01,1934-08-14,1934,8,Seca
01/08/1934,Vazao15,7.4222,15,1934-08-01,1934-08-15,1934,8,Seca
01/08/1934,Vazao16,6.8108,16,1934-08-01,1934-08-16,1934,8,Seca
01/08/1934,Vazao17,7.114,17,1934-08-01,1934-08-17,1934,8,Seca
01/08/1934,Vazao18,7.114,18,1934-08-01,1934-08-18,1934,8,Seca
01/08/1934,Vazao19,7.4222,19,1934-08-01,1934-08-19,1934,8,Seca
01/08/1934,Vazao20,7.4222,20,1934-08-01,1934-08-20,1934,8,Seca
01/08/1934,Vazao21,7.114,21,1934-08-01,1934-08-21,1934,8,Seca
01/08/1934,Vazao22,7.4222,22,1934-08-01,1934-08-22,1934,8,Seca
01/08/1934,Vazao23,7.114,23,1934-08-01,1934-08-23,1934,8,Seca
01/08/1934,Vazao24,7.4222,24,1934-08-01,1934-08-24,1934,8,Seca
01/08/1934,Vazao25,7.4222,25,1934-08-01,1934-08-25,1934,8,Seca
01/08/1934,Vazao26,7.7351,26,1934-08-01,1934-08-26,1934,8,Seca
01/08/1934,Vazao27,7.4222,27,1934-08-01,1934-08-27,1934,8,Seca
01/08/1934,Vazao28,7.4222,28,1934-08-01,1934-08-28,1934,8,Seca
01/08/1934,Vazao29,6.8108,29,1934-08-01,1934-08-29,1934,8,Seca
01/08/1934,Vazao30,6.8108,30,1934-08-01,1934-08-30,1934,8,Seca
01/08/1934,Vazao31,6.8108,31,1934-08-01,1934-08-31,1934,8,Seca
01/09/1934,Vazao01,6.8108,1,1934-09-01,1934-09-01,1934,9,Seca
01/09/1934,Vazao02,7.114,2,1934-09-01,1934-09-02,1934,9,Seca
01/09/1934,Vazao03,7.4222,3,1934-09-01,1934-09-03,1934,9,Seca
01/09/1934,Vazao04,7.114,4,1934-09-01,1934-09-04,1934,9,Seca
01/09/1934,Vazao05,7.4222,5,1934-09-01,1934-09-05,1934,9,Seca
01/09/1934,Vazao06,7.114,6,1934-09-01,1934-09-06,1934,9,Seca
01/09/1934,Vazao07,7.114,7,1934-09-01,1934-09-07,1934,9,Seca
01/09/1934,Vazao08,7.114,8,1934-09-01,1934-09-08,1934,9,Seca
01/09/1934,Vazao09,9.0342,9,1934-09-01,1934-09-09,1934,9,Normal
01/09/1934,Vazao10,9.0342,10,1934-09-01,1934-09-10,1934,9,Normal
01/09/1934,Vazao11,9.0342,11,1934-09-01,1934-09-11,1934,9,Normal
01/09/1934,Vazao12,8.3753,12,1934-09-01,1934-09-12,1934,9,Seca
01/09/1934,Vazao13,8.3753,13,1934-09-01,1934-09-13,1934,9,Seca
01/09/1934,Vazao14,8.3753,14,1934-09-01,1934-09-14,1934,9,Seca
01/09/1934,Vazao15,8.3753,15,1934-09-01,1934-09-15,1934,9,Seca
01/09/1934,Vazao16,8.7024,16,1934-09-01,1934-09-16,1934,9,Normal
01/09/1934,Vazao17,16.5816,17,1934-09-01,1934-09-17,1934,9,Normal
01/09/1934,Vazao18,17.002,18,1934-09-01,1934-09-18,1934,9,Normal
01/09/1934,Vazao19,12.2214,19,1934-09-01,1934-09-19,1934,9,Normal
01/09/1934,Vazao20,16.165,20,1934-09-01,1934-09-20,1934,9,Normal
01/09/1934,Vazao21,21.8787,21,1934-09-01,1934-09-21,1934,9,Normal
01/09/1934,Vazao22,12.9772,22,1934-09-01,1934-09-22,1934,9,Normal
01/09/1934,Vazao23,14.1421,23,1934-09-01,1934-09-23,1934,9,Normal
01/09/1934,Vazao24,10.4066,24,1934-09-01,1934-09-24,1934,9,Normal
01/09/1934,Vazao25,9.3705,25,1934-09-01,1934-09-25,1934,9,Normal
01/09/1934,Vazao26,8.7024,26,1934-09-01,1934-09-26,1934,9,Normal
01/09/1934,Vazao27,12.5972,27,1934-09-01,1934-09-27,1934,9,Normal
01/09/1934,Vazao28,12.5972,28,1934-09-01,1934-09-28,1934,9,Normal
01/09/1934,Vazao29,12.5972,29,1934-09-01,1934-09-29,1934,9,Normal
01/09/1934,Vazao30,10.0568,30,1934-09-01,1934-09-30,1934,9,Normal
01/10/1934,Vazao01,8.7024,1,1934-10-01,1934-10-01,1934,10,Normal
01/10/1934,Vazao02,8.7024,2,1934-10-01,1934-10-02,1934,10,Normal
01/10/1934,Vazao03,8.3753,3,1934-10-01,1934-10-03,1934,10,Seca
01/10/1934,Vazao04,7.114,4,1934-10-01,1934-10-04,1934,10,Seca
01/10/1934,Vazao05,6.5124,5,1934-10-01,1934-10-05,1934,10,Seca
01/10/1934,Vazao06,5.9308,6,1934-10-01,1934-10-06,1934,10,Seca
01/10/1934,Vazao07,5.9308,7,1934-10-01,1934-10-07,1934,10,Seca
01/10/1934,Vazao08,12.5972,8,1934-10-01,1934-10-08,1934,10,Normal
01/10/1934,Vazao09,28.7213,9,1934-10-01,1934-10-09,1934,10,Normal
01/10/1934,Vazao10,17.8546,10,1934-10-01,1934-10-10,1934,10,Normal
01/10/1934,Vazao11,12.5972,11,1934-10-01,1934-10-11,1934,10,Normal
01/10/1934,Vazao12,10.4066,12,1934-10-01,1934-10-12,1934,10,Normal
01/10/1934,Vazao13,10.4066,13,1934-10-01,1934-10-13,1934,10,Normal
01/10/1934,Vazao14,11.1195,14,1934-10-01,1934-10-14,1934,10,Normal
01/10/1934,Vazao15,9.0342,15,1934-10-01,1934-10-15,1934,10,Normal
01/10/1934,Vazao16,8.7024,16,1934-10-01,1934-10-16,1934,10,Normal
01/10/1934,Vazao17,8.0529,17,1934-10-01,1934-10-17,1934,10,Seca
01/10/1934,Vazao18,7.114,18,1934-10-01,1934-10-18,1934,10,Seca
01/10/1934,Vazao19,7.114,19,1934-10-01,1934-10-19,1934,10,Seca
01/10/1934,Vazao20,7.114,20,1934-10-01,1934-10-20,1934,10,Seca
01/10/1934,Vazao21,6.8108,21,1934-10-01,1934-10-21,1934,10,Seca
01/10/1934,Vazao22,5.9308,22,1934-10-01,1934-10-22,1934,10,Seca
01/10/1934,Vazao23,14.1421,23,1934-10-01,1934-10-23,1934,10,Normal
01/10/1934,Vazao24,12.5972,24,1934-10-01,1934-10-24,1934,10,Normal
01/10/1934,Vazao25,9.0342,25,1934-10-01,1934-10-25,1934,10,Normal
01/10/1934,Vazao26,8.3753,26,1934-10-01,1934-10-26,1934,10,Seca
01/10/1934,Vazao27,7.4222,27,1934-10-01,1934-10-27,1934,10,Seca
01/10/1934,Vazao28,6.2191,28,1934-10-01,1934-10-28,1934,10,Seca
01/10/1934,Vazao29,7.7351,29,1934-10-01,1934-10-29,1934,10,Seca
01/10/1934,Vazao30,23.763,30,1934-10-01,1934-10-30,1934,10,Normal
01/10/1934,Vazao31,18.7225,31,1934-10-01,1934-10-31,1934,10,Normal
01/11/1934,Vazao01,12.2214,1,1934-11-01,1934-11-01,1934,11,Normal
01/11/1934,Vazao02,9.3705,2,1934-11-01,1934-11-02,1934,11,Normal
01/11/1934,Vazao03,8.3753,3,1934-11-01,1934-11-03,1934,11,Seca
01/11/1934,Vazao04,8.0529,4,1934-11-01,1934-11-04,1934,11,Seca
01/11/1934,Vazao05,6.2191,5,1934-11-01,1934-11-05,1934,11,Seca
01/11/1934,Vazao06,5.6476,6,1934-11-01,1934-11-06,1934,11,Seca
01/11/1934,Vazao07,4.8293,7,1934-11-01,1934-11-07,1934,11,Seca
01/11/1934,Vazao08,4.5673,8,1934-11-01,1934-11-08,1934,11,Seca
01/11/1934,Vazao09,5.3696,9,1934-11-01,1934-11-09,1934,11,Seca
01/11/1934,Vazao10,17.4264,10,1934-11-01,1934-11-10,1934,11,Normal
01/11/1934,Vazao11,17.8546,11,1934-11-01,1934-11-11,1934,11,Normal
01/11/1934,Vazao12,8.7024,12,1934-11-01,1934-11-12,1934,11,Normal
01/11/1934,Vazao13,17.4264,13,1934-11-01,1934-11-13,1934,11,Normal
01/11/1934,Vazao14,10.0568,14,1934-11-01,1934-11-14,1934,11,Normal
01/11/1934,Vazao15,8.0529,15,1934-11-01,1934-11-15,1934,11,Seca
01/11/1934,Vazao16,6.5124,16,1934-11-01,1934-11-16,1934,11,Seca
01/11/1934,Vazao17,12.5972,17,1934-11-01,1934-11-17,1934,11,Normal
01/11/1934,Vazao18,41.9826,18,1934-11-01,1934-11-18,1934,11,Normal
01/11/1934,Vazao19,19.6056,19,1934-11-01,1934-11-19,1934,11,Normal
01/11/1934,Vazao20,20.0528,20,1934-11-01,1934-11-20,1934,11,Normal
01/11/1934,Vazao21,14.9393,21,1934-11-01,1934-11-21,1934,11,Normal
01/11/1934,Vazao22,10.4066,22,1934-11-01,1934-11-22,1934,11,Normal
01/11/1934,Vazao23,8.7024,23,1934-11-01,1934-11-23,1934,11,Normal
01/11/1934,Vazao24,7.114,24,1934-11-01,1934-11-24,1934,11,Seca
01/11/1934,Vazao25,6.5124,25,1934-11-01,1934-11-25,1934,11,Seca
01/11/1934,Vazao26,5.6476,26,1934-11-01,1934-11-26,1934,11,Seca
01/11/1934,Vazao27,5.0968,27,1934-11-01,1934-11-27,1934,11,Seca
01/11/1934,Vazao28,11.1195,28,1934-11-01,1934-11-28,1934,11,Normal
01/11/1934,Vazao29,16.5816,29,1934-11-01,1934-11-29,1934,11,Normal
01/11/1934,Vazao30,17.8546,30,1934-11-01,1934-11-30,1934,11,Normal
01/12/1934,Vazao01,19.6056,1,1934-12-01,1934-12-01,1934,12,Normal
01/12/1934,Vazao02,20.5037,2,1934-12-01,1934-12-02,1934,12,Normal
01/12/1934,Vazao03,18.7225,3,1934-12-01,1934-12-03,1934,12,Normal
01/12/1934,Vazao04,18.2866,4,1934-12-01,1934-12-04,1934,12,Normal
01/12/1934,Vazao05,25.7045,5,1934-12-01,1934-12-05,1934,12,Normal
01/12/1934,Vazao06,30.8008,6,1934-12-01,1934-12-06,1934,12,Normal
01/12/1934,Vazao07,28.2099,7,1934-12-01,1934-12-07,1934,12,Normal
01/12/1934,Vazao08,22.3444,8,1934-12-01,1934-12-08,1934,12,Normal
01/12/1934,Vazao09,27.1974,9,1934-12-01,1934-12-09,1934,12,Normal
01/12/1934,Vazao10,21.8787,10,1934-12-01,1934-12-10,1934,12,Normal
01/12/1934,Vazao11,16.165,11,1934-12-01,1934-12-11,1934,12,Normal
01/12/1934,Vazao12,16.5816,12,1934-12-01,1934-12-12,1934,12,Normal
01/12/1934,Vazao13,28.7213,13,1934-12-01,1934-12-13,1934,12,Normal
01/12/1934,Vazao14,29.2361,14,1934-12-01,1934-12-14,1934,12,Normal
01/12/1934,Vazao15,90.4614,15,1934-12-01,1934-12-15,1934,12,Cheia
01/12/1934,Vazao16,55.0517,16,1934-12-01,1934-12-16,1934,12,Normal
01/12/1934,Vazao17,81.0623,17,1934-12-01,1934-12-17,1934,12,Normal
01/12/1934,Vazao18,65.1689,18,1934-12-01,1934-12-18,1934,12,Normal
01/12/1934,Vazao19,84.5336,19,1934-12-01,1934-12-19,1934,12,Normal
01/12/1934,Vazao20,109.298,20,1934-12-01,1934-12-20,1934,12,Cheia
01/12/1934,Vazao21,121.3476,21,1934-12-01,1934-12-21,1934,12,Cheia
01/12/1934,Vazao22,112.5893,22,1934-12-01,1934-12-22,1934,12,Cheia
01/12/1934,Vazao23,86.8835,23,1934-12-01,1934-12-23,1934,12,Normal
01/12/1934,Vazao24,71.5774,24,1934-12-01,1934-12-24,1934,12,Normal
01/12/1934,Vazao25,78.7838,25,1934-12-01,1934-12-25,1934,12,Normal
01/12/1934,Vazao26,61.0462,26,1934-12-01,1934-12-26,1934,12,Normal
01/12/1934,Vazao27,55.7064,27,1934-12-01,1934-12-27,1934,12,Normal
01/12/1934,Vazao28,108.6449,28,1934-12-01,1934-12-28,1934,12,Cheia
01/12/1934,Vazao29,107.9935,29,1934-12-01,1934-12-29,1934,12,Cheia
01/12/1934,Vazao30,85.1184,30,1934-12-01,1934-12-30,1934,12,Normal
01/12/1934,Vazao31,62.4093,31,1934-12-01,1934-12-31,1934,12,Normal
01/01/1935,Vazao01,44.9745,1,1935-01-01,1935-01-01,1935,1,Normal
01/01/1935,Vazao02,42.5748,2,1935-01-01,1935-01-02,1935,1,Normal
01/01/1935,Vazao03,67.9726,3,1935-01-01,1935-01-03,1935,1,Normal
01/01/1935,Vazao04,61.0462,4,1935-01-01,1935-01-04,1935,1,Normal
01/01/1935,Vazao05,49.9187,5,1935-01-01,1935-01-05,1935,1,Normal
01/01/1935,Vazao06,43.7686,6,1935-01-01,1935-01-06,1935,1,Normal
01/01/1935,Vazao07,35.1193,7,1935-01-01,1935-01-07,1935,1,Normal
01/01/1935,Vazao08,99.6834,8,1935-01-01,1935-01-08,1935,1,Cheia
01/01/1935,Vazao09,90.4614,9,1935-01-01,1935-01-09,1935,1,Cheia
01/01/1935,Vazao10,58.3536,10,1935-01-01,1935-01-10,1935,1,Normal
01/01/1935,Vazao11,48.6648,11,1935-01-01,1935-01-11,1935,1,Normal
01/01/1935,Vazao12,40.2243,12,1935-01-01,1935-01-12,1935,1,Normal
01/01/1935,Vazao13,36.2314,13,1935-01-01,1935-01-13,1935,1,Normal
01/01/1935,Vazao14,70.4958,14,1935-01-01,1935-01-14,1935,1,Normal
01/01/1935,Vazao15,49.2903,15,1935-01-01,1935-01-15,1935,1,Normal
01/01/1935,Vazao16,35.1193,16,1935-01-01,1935-01-16,1935,1,Normal
01/01/1935,Vazao17,25.7045,17,1935-01-01,1935-01-17,1935,1,Normal
01/01/1935,Vazao18,26.6963,18,1935-01-01,1935-01-18,1935,1,Normal
01/01/1935,Vazao19,27.1974,19,1935-01-01,1935-01-19,1935,1,Normal
01/01/1935,Vazao20,25.7045,20,1935-01-01,1935-01-20,1935,1,Normal
01/01/1935,Vazao21,36.2314,21,1935-01-01,1935-01-21,1935,1,Normal
01/01/1935,Vazao22,48.0423,22,1935-01-01,1935-01-22,1935,1,Normal
01/01/1935,Vazao23,48.6648,23,1935-01-01,1935-01-23,1935,1,Normal
01/01/1935,Vazao24,44.37,24,1935-01-01,1935-01-24,1935,1,Normal
01/01/1935,Vazao25,49.2903,25,1935-01-01,1935-01-25,1935,1,Normal
01/01/1935,Vazao26,51.8217,26,1935-01-01,1935-01-26,1935,1,Normal
01/01/1935,Vazao27,48.0423,27,1935-01-01,1935-01-27,1935,1,Normal
01/01/1935,Vazao28,39.6444,28,1935-01-01,1935-01-28,1935,1,Normal
01/01/1935,Vazao29,34.568,29,1935-01-01,1935-01-29,1935,1,Normal
01/01/1935,Vazao30,34.568,30,1935-01-01,1935-01-30,1935,1,Normal
01/01/1935,Vazao31,65.8657,31,1935-01-01,1935-01-31,1935,1,Normal
01/02/1935,Vazao01,84.5336,1,1935-02-01,1935-02-01,1935,2,Normal
01/02/1935,Vazao02,79.9195,2,1935-02-01,1935-02-02,1935,2,Normal
01/02/1935,Vazao03,98.431,3,1935-02-01,1935-02-03,1935,2,Cheia
01/02/1935,Vazao04,92.8819,4,1935-02-01,1935-02-04,1935,2,Cheia
01/02/1935,Vazao05,50.5501,5,1935-02-01,1935-02-05,1935,2,Normal
01/02/1935,Vazao06,81.0623,6,1935-02-01,1935-02-06,1935,2,Normal
01/02/1935,Vazao07,73.2133,7,1935-02-01,1935-02-07,1935,2,Normal
01/02/1935,Vazao08,84.5336,8,1935-02-01,1935-02-08,1935,2,Normal
01/02/1935,Vazao09,87.4754,9,1935-02-01,1935-02-09,1935,2,Normal
01/02/1935,Vazao10,77.0938,10,1935-02-01,1935-02-10,1935,2,Normal
01/02/1935,Vazao11,79.3507,11,1935-02-01,1935-02-11,1935,2,Normal
01/02/1935,Vazao12,70.4958,12,1935-02-01,1935-02-12,1935,2,Normal
01/02/1935,Vazao13,66.5653,13,1935-02-01,1935-02-13,1935,2,Normal
01/02/1935,Vazao14,112.5893,14,1935-02-01,1935-02-14,1935,2,Cheia
01/02/1935,Vazao15,122.7207,15,1935-02-01,1935-02-15,1935,2,Cheia
01/02/1935,Vazao16,104.1216,16,1935-02-01,1935-02-16,1935,2,Cheia
01/02/1935,Vazao17,97.1856,17,1935-02-01,1935-02-17,1935,2,Cheia
01/02/1935,Vazao18,93.4915,18,1935-02-01,1935-02-18,1935,2,Cheia
01/02/1935,Vazao19,87.4754,19,1935-02-01,1935-02-19,1935,2,Normal
01/02/1935,Vazao20,115.9237,20,1935-02-01,1935-02-20,1935,2,Cheia
01/02/1935,Vazao21,102.2091,21,1935-02-01,1935-02-21,1935,2,Cheia
01/02/1935,Vazao22,78.2187,22,1935-02-01,1935-02-22,1935,2,Normal
01/02/1935,Vazao23,73.2133,23,1935-02-01,1935-02-23,1935,2,Normal
01/02/1935,Vazao24,66.5653,24,1935-02-01,1935-02-24,1935,2,Normal
01/02/1935,Vazao25,100.9428,25,1935-02-01,1935-02-25,1935,2,Cheia
01/02/1935,Vazao26,63.7836,26,1935-02-01,1935-02-26,1935,2,Normal
01/02/1935,Vazao27,58.3536,27,1935-02-01,1935-02-27,1935,2,Normal
01/02/1935,Vazao28,78.7838,28,1935-02-01,1935-02-28,1935,2,Normal
01/03/1935,Vazao01,53.751,1,1935-03-01,1935-03-01,1935,3,Normal
01/03/1935,Vazao02,42.5748,2,1935-03-01,1935-03-02,1935,3,Normal
01/03/1935,Vazao03,44.37,3,1935-03-01,1935-03-03,1935,3,Normal
01/03/1935,Vazao04,37.3564,4,1935-03-01,1935-03-04,1935,3,Normal
01/03/1935,Vazao05,35.1193,5,1935-03-01,1935-03-05,1935,3,Normal
01/03/1935,Vazao06,39.0677,6,1935-03-01,1935-03-06,1935,3,Normal
01/03/1935,Vazao07,41.3934,7,1935-03-01,1935-03-07,1935,3,Normal
01/03/1935,Vazao08,48.0423,8,1935-03-01,1935-03-08,1935,3,Normal
01/03/1935,Vazao09,44.9745,9,1935-03-01,1935-03-09,1935,3,Normal
01/03/1935,Vazao10,39.6444,10,1935-03-01,1935-03-10,1935,3,Normal
01/03/1935,Vazao11,35.6737,11,1935-03-01,1935-03-11,1935,3,Normal
01/03/1935,Vazao12,32.9338,12,1935-03-01,1935-03-12,1935,3,Normal
01/03/1935,Vazao13,39.6444,13,1935-03-01,1935-03-13,1935,3,Normal
01/03/1935,Vazao14,32.9338,14,1935-03-01,1935-03-14,1935,3,Normal
01/03/1935,Vazao15,39.6444,15,1935-03-01,1935-03-15,1935,3,Normal
01/03/1935,Vazao16,38.4941,16,1935-03-01,1935-03-16,1935,3,Normal
01/03/1935,Vazao17,32.3956,17,1935-03-01,1935-03-17,1935,3,Normal
01/03/1935,Vazao18,36.7923,18,1935-03-01,1935-03-18,1935,3,Normal
01/03/1935,Vazao19,30.2759,19,1935-03-01,1935-03-19,1935,3,Normal
01/03/1935,Vazao20,32.9338,20,1935-03-01,1935-03-20,1935,3,Normal
01/03/1935,Vazao21,28.2099,21,1935-03-01,1935-03-21,1935,3,Normal
01/03/1935,Vazao22,33.4752,22,1935-03-01,1935-03-22,1935,3,Normal
01/03/1935,Vazao23,31.8607,23,1935-03-01,1935-03-23,1935,3,Normal
01/03/1935,Vazao24,27.1974,24,1935-03-01,1935-03-24,1935,3,Normal
01/03/1935,Vazao25,26.1986,25,1935-03-01,1935-03-25,1935,3,Normal
01/03/1935,Vazao26,25.7045,26,1935-03-01,1935-03-26,1935,3,Normal
01/03/1935,Vazao27,25.2138,27,1935-03-01,1935-03-27,1935,3,Normal
01/03/1935,Vazao28,24.7267,28,1935-03-01,1935-03-28,1935,3,Normal
01/03/1935,Vazao29,24.7267,29,1935-03-01,1935-03-29,1935,3,Normal
01/03/1935,Vazao30,23.763,30,1935-03-01,1935-03-30,1935,3,Normal
01/03/1935,Vazao31,23.763,31,1935-03-01,1935-03-31,1935,3,Normal
01/04/1935,Vazao01,24.7267,1,1935-04-01,1935-04-01,1935,4,Normal
01/04/1935,Vazao02,24.7267,2,1935-04-01,1935-04-02,1935,4,Normal
01/04/1935,Vazao03,101.575,3,1935-04-01,1935-04-03,1935,4,Cheia
01/04/1935,Vazao04,94.1028,4,1935-04-01,1935-04-04,1935,4,Cheia
01/04/1935,Vazao05,70.4958,5,1935-04-01,1935-04-05,1935,4,Normal
01/04/1935,Vazao06,44.9745,6,1935-04-01,1935-04-06,1935,4,Normal
01/04/1935,Vazao07,43.1702,7,1935-04-01,1935-04-07,1935,4,Normal
01/04/1935,Vazao08,38.4941,8,1935-04-01,1935-04-08,1935,4,Normal
01/04/1935,Vazao09,43.1702,9,1935-04-01,1935-04-09,1935,4,Normal
01/04/1935,Vazao10,47.4227,10,1935-04-01,1935-04-10,1935,4,Normal
01/04/1935,Vazao11,39.0677,11,1935-04-01,1935-04-11,1935,4,Normal
01/04/1935,Vazao12,31.3291,12,1935-04-01,1935-04-12,1935,4,Normal
01/04/1935,Vazao13,29.2361,13,1935-04-01,1935-04-13,1935,4,Normal
01/04/1935,Vazao14,30.8008,14,1935-04-01,1935-04-14,1935,4,Normal
01/04/1935,Vazao15,71.0357,15,1935-04-01,1935-04-15,1935,4,Normal
01/04/1935,Vazao16,43.7686,16,1935-04-01,1935-04-16,1935,4,Normal
01/04/1935,Vazao17,36.7923,17,1935-04-01,1935-04-17,1935,4,Normal
01/04/1935,Vazao18,30.2759,18,1935-04-01,1935-04-18,1935,4,Normal
01/04/1935,Vazao19,29.2361,19,1935-04-01,1935-04-19,1935,4,Normal
01/04/1935,Vazao20,29.2361,20,1935-04-01,1935-04-20,1935,4,Normal
01/04/1935,Vazao21,28.2099,21,1935-04-01,1935-04-21,1935,4,Normal
01/04/1935,Vazao22,41.3934,22,1935-04-01,1935-04-22,1935,4,Normal
01/04/1935,Vazao23,53.105,23,1935-04-01,1935-04-23,1935,4,Normal
01/04/1935,Vazao24,35.6737,24,1935-04-01,1935-04-24,1935,4,Normal
01/04/1935,Vazao25,30.2759,25,1935-04-01,1935-04-25,1935,4,Normal
01/04/1935,Vazao26,28.2099,26,1935-04-01,1935-04-26,1935,4,Normal
01/04/1935,Vazao27,27.1974,27,1935-04-01,1935-04-27,1935,4,Normal
01/04/1935,Vazao28,26.6963,28,1935-04-01,1935-04-28,1935,4,Normal
01/04/1935,Vazao29,35.6737,29,1935-04-01,1935-04-29,1935,4,Normal
01/04/1935,Vazao30,35.6737,30,1935-04-01,1935-04-30,1935,4,Normal
01/05/1935,Vazao01,34.568,1,1935-05-01,1935-05-01,1935,5,Normal
01/05/1935,Vazao02,27.1974,2,1935-05-01,1935-05-02,1935,5,Normal
01/05/1935,Vazao03,27.1974,3,1935-05-01,1935-05-03,1935,5,Normal
01/05/1935,Vazao04,25.2138,4,1935-05-01,1935-05-04,1935,5,Normal
01/05/1935,Vazao05,23.763,5,1935-05-01,1935-05-05,1935,5,Normal
01/05/1935,Vazao06,25.2138,6,1935-05-01,1935-05-06,1935,5,Normal
01/05/1935,Vazao07,25.2138,7,1935-05-01,1935-05-07,1935,5,Normal
01/05/1935,Vazao08,25.2138,8,1935-05-01,1935-05-08,1935,5,Normal
01/05/1935,Vazao09,26.1986,9,1935-05-01,1935-05-09,1935,5,Normal
01/05/1935,Vazao10,24.2431,10,1935-05-01,1935-05-10,1935,5,Normal
01/05/1935,Vazao11,24.2431,11,1935-05-01,1935-05-11,1935,5,Normal
01/05/1935,Vazao12,24.2431,12,1935-05-01,1935-05-12,1935,5,Normal
01/05/1935,Vazao13,22.3444,13,1935-05-01,1935-05-13,1935,5,Normal
01/05/1935,Vazao14,22.3444,14,1935-05-01,1935-05-14,1935,5,Normal
01/05/1935,Vazao15,21.4167,15,1935-05-01,1935-05-15,1935,5,Normal
01/05/1935,Vazao16,20.5037,16,1935-05-01,1935-05-16,1935,5,Normal
01/05/1935,Vazao17,20.5037,17,1935-05-01,1935-05-17,1935,5,Normal
01/05/1935,Vazao18,20.5037,18,1935-05-01,1935-05-18,1935,5,Normal
01/05/1935,Vazao19,20.5037,19,1935-05-01,1935-05-19,1935,5,Normal
01/05/1935,Vazao20,36.2314,20,1935-05-01,1935-05-20,1935,5,Normal
01/05/1935,Vazao21,67.9726,21,1935-05-01,1935-05-21,1935,5,Normal
01/05/1935,Vazao22,54.3999,22,1935-05-01,1935-05-22,1935,5,Normal
01/05/1935,Vazao23,40.8073,23,1935-05-01,1935-05-23,1935,5,Normal
01/05/1935,Vazao24,32.9338,24,1935-05-01,1935-05-24,1935,5,Normal
01/05/1935,Vazao25,38.4941,25,1935-05-01,1935-05-25,1935,5,Normal
01/05/1935,Vazao26,25.7045,26,1935-05-01,1935-05-26,1935,5,Normal
01/05/1935,Vazao27,25.7045,27,1935-05-01,1935-05-27,1935,5,Normal
01/05/1935,Vazao28,18.2866,28,1935-05-01,1935-05-28,1935,5,Normal
01/05/1935,Vazao29,18.2866,29,1935-05-01,1935-05-29,1935,5,Normal
01/05/1935,Vazao30,18.2866,30,1935-05-01,1935-05-30,1935,5,Normal
01/05/1935,Vazao31,23.763,31,1935-05-01,1935-05-31,1935,5,Normal
01/06/1935,Vazao01,23.763,1,1935-06-01,1935-06-01,1935,6,Normal
01/06/1935,Vazao02,21.8787,2,1935-06-01,1935-06-02,1935,6,Normal
01/06/1935,Vazao03,21.8787,3,1935-06-01,1935-06-03,1935,6,Normal
01/06/1935,Vazao04,20.0528,4,1935-06-01,1935-06-04,1935,6,Normal
01/06/1935,Vazao05,20.0528,5,1935-06-01,1935-06-05,1935,6,Normal
01/06/1935,Vazao06,20.0528,6,1935-06-01,1935-06-06,1935,6,Normal
01/06/1935,Vazao07,20.0528,7,1935-06-01,1935-06-07,1935,6,Normal
01/06/1935,Vazao08,20.0528,8,1935-06-01,1935-06-08,1935,6,Normal
01/06/1935,Vazao09,20.0528,9,1935-06-01,1935-06-09,1935,6,Normal
01/06/1935,Vazao10,20.0528,10,1935-06-01,1935-06-10,1935,6,Normal
01/06/1935,Vazao11,20.0528,11,1935-06-01,1935-06-11,1935,6,Normal
01/06/1935,Vazao12,24.7267,12,1935-06-01,1935-06-12,1935,6,Normal
01/06/1935,Vazao13,24.7267,13,1935-06-01,1935-06-13,1935,6,Normal
01/06/1935,Vazao14,24.2431,14,1935-06-01,1935-06-14,1935,6,Normal
01/06/1935,Vazao15,20.9584,15,1935-06-01,1935-06-15,1935,6,Normal
01/06/1935,Vazao16,20.9584,16,1935-06-01,1935-06-16,1935,6,Normal
01/06/1935,Vazao17,19.1622,17,1935-06-01,1935-06-17,1935,6,Normal
01/06/1935,Vazao18,19.1622,18,1935-06-01,1935-06-18,1935,6,Normal
01/06/1935,Vazao19,19.1622,19,1935-06-01,1935-06-19,1935,6,Normal
01/06/1935,Vazao20,19.1622,20,1935-06-01,1935-06-20,1935,6,Normal
01/06/1935,Vazao21,19.1622,21,1935-06-01,1935-06-21,1935,6,Normal
01/06/1935,Vazao22,19.1622,22,1935-06-01,1935-06-22,1935,6,Normal
01/06/1935,Vazao23,18.7225,23,1935-06-01,1935-06-23,1935,6,Normal
01/06/1935,Vazao24,18.7225,24,1935-06-01,1935-06-24,1935,6,Normal
01/06/1935,Vazao25,18.7225,25,1935-06-01,1935-06-25,1935,6,Normal
01/06/1935,Vazao26,18.2866,26,1935-06-01,1935-06-26,1935,6,Normal
01/06/1935,Vazao27,18.2866,27,1935-06-01,1935-06-27,1935,6,Normal
01/06/1935,Vazao28,18.2866,28,1935-06-01,1935-06-28,1935,6,Normal
01/06/1935,Vazao29,18.2866,29,1935-06-01,1935-06-29,1935,6,Normal
01/06/1935,Vazao30,16.5816,30,1935-06-01,1935-06-30,1935,6,Normal
01/07/1935,Vazao01,16.165,1,1935-07-01,1935-07-01,1935,7,Normal
01/07/1935,Vazao02,15.7525,2,1935-07-01,1935-07-02,1935,7,Normal
01/07/1935,Vazao03,15.7525,3,1935-07-01,1935-07-03,1935,7,Normal
01/07/1935,Vazao04,15.7525,4,1935-07-01,1935-07-04,1935,7,Normal
01/07/1935,Vazao05,15.7525,5,1935-07-01,1935-07-05,1935,7,Normal
01/07/1935,Vazao06,15.7525,6,1935-07-01,1935-07-06,1935,7,Normal
01/07/1935,Vazao07,15.3439,7,1935-07-01,1935-07-07,1935,7,Normal
01/07/1935,Vazao08,15.3439,8,1935-07-01,1935-07-08,1935,7,Normal
01/07/1935,Vazao09,15.3439,9,1935-07-01,1935-07-09,1935,7,Normal
01/07/1935,Vazao10,15.3439,10,1935-07-01,1935-07-10,1935,7,Normal
01/07/1935,Vazao11,15.3439,11,1935-07-01,1935-07-11,1935,7,Normal
01/07/1935,Vazao12,15.3439,12,1935-07-01,1935-07-12,1935,7,Normal
01/07/1935,Vazao13,15.3439,13,1935-07-01,1935-07-13,1935,7,Normal
01/07/1935,Vazao14,15.3439,14,1935-07-01,1935-07-14,1935,7,Normal
01/07/1935,Vazao15,14.9393,15,1935-07-01,1935-07-15,1935,7,Normal
01/07/1935,Vazao16,14.9393,16,1935-07-01,1935-07-16,1935,7,Normal
01/07/1935,Vazao17,14.5387,17,1935-07-01,1935-07-17,1935,7,Normal
01/07/1935,Vazao18,14.5387,18,1935-07-01,1935-07-18,1935,7,Normal
01/07/1935,Vazao19,14.5387,19,1935-07-01,1935-07-19,1935,7,Normal
01/07/1935,Vazao20,14.5387,20,1935-07-01,1935-07-20,1935,7,Normal
01/07/1935,Vazao21,14.1421,21,1935-07-01,1935-07-21,1935,7,Normal
01/07/1935,Vazao22,14.1421,22,1935-07-01,1935-07-22,1935,7,Normal
01/07/1935,Vazao23,13.7497,23,1935-07-01,1935-07-23,1935,7,Normal
01/07/1935,Vazao24,14.1421,24,1935-07-01,1935-07-24,1935,7,Normal
01/07/1935,Vazao25,14.5387,25,1935-07-01,1935-07-25,1935,7,Normal
01/07/1935,Vazao26,16.5816,26,1935-07-01,1935-07-26,1935,7,Normal
01/07/1935,Vazao27,19.1622,27,1935-07-01,1935-07-27,1935,7,Normal
01/07/1935,Vazao28,19.6056,28,1935-07-01,1935-07-28,1935,7,Normal
01/07/1935,Vazao29,25.7045,29,1935-07-01,1935-07-29,1935,7,Normal
01/07/1935,Vazao30,19.6056,30,1935-07-01,1935-07-30,1935,7,Normal
01/07/1935,Vazao31,18.2866,31,1935-07-01,1935-07-31,1935,7,Normal
01/08/1935,Vazao01,14.9393,1,1935-08-01,1935-08-01,1935,8,Normal
01/08/1935,Vazao02,14.5387,2,1935-08-01,1935-08-02,1935,8,Normal
01/08/1935,Vazao03,14.1421,3,1935-08-01,1935-08-03,1935,8,Normal
01/08/1935,Vazao04,14.1421,4,1935-08-01,1935-08-04,1935,8,Normal
01/08/1935,Vazao05,14.1421,5,1935-08-01,1935-08-05,1935,8,Normal
01/08/1935,Vazao06,13.7497,6,1935-08-01,1935-08-06,1935,8,Normal
01/08/1935,Vazao07,13.7497,7,1935-08-01,1935-08-07,1935,8,Normal
01/08/1935,Vazao08,13.3614,8,1935-08-01,1935-08-08,1935,8,Normal
01/08/1935,Vazao09,13.3614,9,1935-08-01,1935-08-09,1935,8,Normal
01/08/1935,Vazao10,12.9772,10,1935-08-01,1935-08-10,1935,8,Normal
01/08/1935,Vazao11,12.9772,11,1935-08-01,1935-08-11,1935,8,Normal
01/08/1935,Vazao12,14.1421,12,1935-08-01,1935-08-12,1935,8,Normal
01/08/1935,Vazao13,14.1421,13,1935-08-01,1935-08-13,1935,8,Normal
01/08/1935,Vazao14,13.3614,14,1935-08-01,1935-08-14,1935,8,Normal
01/08/1935,Vazao15,12.5972,15,1935-08-01,1935-08-15,1935,8,Normal
01/08/1935,Vazao16,12.5972,16,1935-08-01,1935-08-16,1935,8,Normal
01/08/1935,Vazao17,12.2214,17,1935-08-01,1935-08-17,1935,8,Normal
01/08/1935,Vazao18,11.8498,18,1935-08-01,1935-08-18,1935,8,Normal
01/08/1935,Vazao19,11.8498,19,1935-08-01,1935-08-19,1935,8,Normal
01/08/1935,Vazao20,11.4825,20,1935-08-01,1935-08-20,1935,8,Normal
01/08/1935,Vazao21,11.4825,21,1935-08-01,1935-08-21,1935,8,Normal
01/08/1935,Vazao22,10.7609,22,1935-08-01,1935-08-22,1935,8,Normal
01/08/1935,Vazao23,10.4066,23,1935-08-01,1935-08-23,1935,8,Normal
01/08/1935,Vazao24,10.7609,24,1935-08-01,1935-08-24,1935,8,Normal
01/08/1935,Vazao25,11.1195,25,1935-08-01,1935-08-25,1935,8,Normal
01/08/1935,Vazao26,11.8498,26,1935-08-01,1935-08-26,1935,8,Normal
01/08/1935,Vazao27,12.5972,27,1935-08-01,1935-08-27,1935,8,Normal
01/08/1935,Vazao28,13.3614,28,1935-08-01,1935-08-28,1935,8,Normal
01/08/1935,Vazao29,13.3614,29,1935-08-01,1935-08-29,1935,8,Normal
01/08/1935,Vazao30,12.5972,30,1935-08-01,1935-08-30,1935,8,Normal
01/08/1935,Vazao31,12.2214,31,1935-08-01,1935-08-31,1935,8,Normal
01/09/1935,Vazao01,11.8498,1,1935-09-01,1935-09-01,1935,9,Normal
01/09/1935,Vazao02,11.8498,2,1935-09-01,1935-09-02,1935,9,Normal
01/09/1935,Vazao03,11.8498,3,1935-09-01,1935-09-03,1935,9,Normal
01/09/1935,Vazao04,11.8498,4,1935-09-01,1935-09-04,1935,9,Normal
01/09/1935,Vazao05,11.4825,5,1935-09-01,1935-09-05,1935,9,Normal
01/09/1935,Vazao06,11.4825,6,1935-09-01,1935-09-06,1935,9,Normal
01/09/1935,Vazao07,11.4825,7,1935-09-01,1935-09-07,1935,9,Normal
01/09/1935,Vazao08,11.4825,8,1935-09-01,1935-09-08,1935,9,Normal
01/09/1935,Vazao09,11.8498,9,1935-09-01,1935-09-09,1935,9,Normal
01/09/1935,Vazao10,12.5972,10,1935-09-01,1935-09-10,1935,9,Normal
01/09/1935,Vazao11,16.5816,11,1935-09-01,1935-09-11,1935,9,Normal
01/09/1935,Vazao12,16.5816,12,1935-09-01,1935-09-12,1935,9,Normal
01/09/1935,Vazao13,17.4264,13,1935-09-01,1935-09-13,1935,9,Normal
01/09/1935,Vazao14,17.4264,14,1935-09-01,1935-09-14,1935,9,Normal
01/09/1935,Vazao15,17.4264,15,1935-09-01,1935-09-15,1935,9,Normal
01/09/1935,Vazao16,17.4264,16,1935-09-01,1935-09-16,1935,9,Normal
01/09/1935,Vazao17,15.7525,17,1935-09-01,1935-09-17,1935,9,Normal
01/09/1935,Vazao18,15.7525,18,1935-09-01,1935-09-18,1935,9,Normal
01/09/1935,Vazao19,14.9393,19,1935-09-01,1935-09-19,1935,9,Normal
01/09/1935,Vazao20,13.7497,20,1935-09-01,1935-09-20,1935,9,Normal
01/09/1935,Vazao21,13.7497,21,1935-09-01,1935-09-21,1935,9,Normal
01/09/1935,Vazao22,13.7497,22,1935-09-01,1935-09-22,1935,9,Normal
01/09/1935,Vazao23,13.3614,23,1935-09-01,1935-09-23,1935,9,Normal
01/09/1935,Vazao24,13.3614,24,1935-09-01,1935-09-24,1935,9,Normal
01/09/1935,Vazao25,16.165,25,1935-09-01,1935-09-25,1935,9,Normal
01/09/1935,Vazao26,15.7525,26,1935-09-01,1935-09-26,1935,9,Normal
01/09/1935,Vazao27,16.5816,27,1935-09-01,1935-09-27,1935,9,Normal
01/09/1935,Vazao28,14.9393,28,1935-09-01,1935-09-28,1935,9,Normal
01/09/1935,Vazao29,15.3439,29,1935-09-01,1935-09-29,1935,9,Normal
01/09/1935,Vazao30,19.1622,30,1935-09-01,1935-09-30,1935,9,Normal
01/10/1935,Vazao01,22.3444,1,1935-10-01,1935-10-01,1935,10,Normal
01/10/1935,Vazao02,20.0528,2,1935-10-01,1935-10-02,1935,10,Normal
01/10/1935,Vazao03,20.9584,3,1935-10-01,1935-10-03,1935,10,Normal
01/10/1935,Vazao04,20.9584,4,1935-10-01,1935-10-04,1935,10,Normal
01/10/1935,Vazao05,19.6056,5,1935-10-01,1935-10-05,1935,10,Normal
01/10/1935,Vazao06,14.5387,6,1935-10-01,1935-10-06,1935,10,Normal
01/10/1935,Vazao07,15.7525,7,1935-10-01,1935-10-07,1935,10,Normal
01/10/1935,Vazao08,14.9393,8,1935-10-01,1935-10-08,1935,10,Normal
01/10/1935,Vazao09,14.9393,9,1935-10-01,1935-10-09,1935,10,Normal
01/10/1935,Vazao10,16.165,10,1935-10-01,1935-10-10,1935,10,Normal
01/10/1935,Vazao11,15.3439,11,1935-10-01,1935-10-11,1935,10,Normal
01/10/1935,Vazao12,14.5387,12,1935-10-01,1935-10-12,1935,10,Normal
01/10/1935,Vazao13,14.1421,13,1935-10-01,1935-10-13,1935,10,Normal
01/10/1935,Vazao14,20.9584,14,1935-10-01,1935-10-14,1935,10,Normal
01/10/1935,Vazao15,17.002,15,1935-10-01,1935-10-15,1935,10,Normal
01/10/1935,Vazao16,20.0528,16,1935-10-01,1935-10-16,1935,10,Normal
01/10/1935,Vazao17,17.002,17,1935-10-01,1935-10-17,1935,10,Normal
01/10/1935,Vazao18,18.7225,18,1935-10-01,1935-10-18,1935,10,Normal
01/10/1935,Vazao19,14.1421,19,1935-10-01,1935-10-19,1935,10,Normal
01/10/1935,Vazao20,15.7525,20,1935-10-01,1935-10-20,1935,10,Normal
01/10/1935,Vazao21,13.3614,21,1935-10-01,1935-10-21,1935,10,Normal
01/10/1935,Vazao22,12.2214,22,1935-10-01,1935-10-22,1935,10,Normal
01/10/1935,Vazao23,11.8498,23,1935-10-01,1935-10-23,1935,10,Normal
01/10/1935,Vazao24,11.8498,24,1935-10-01,1935-10-24,1935,10,Normal
01/10/1935,Vazao25,28.2099,25,1935-10-01,1935-10-25,1935,10,Normal
01/10/1935,Vazao26,45.5821,26,1935-10-01,1935-10-26,1935,10,Normal
01/10/1935,Vazao27,30.2759,27,1935-10-01,1935-10-27,1935,10,Normal
01/10/1935,Vazao28,55.7064,28,1935-10-01,1935-10-28,1935,10,Normal
01/10/1935,Vazao29,50.5501,29,1935-10-01,1935-10-29,1935,10,Normal
01/10/1935,Vazao30,37.9237,30,1935-10-01,1935-10-30,1935,10,Normal
01/10/1935,Vazao31,26.1986,31,1935-10-01,1935-10-31,1935,10,Normal
01/11/1935,Vazao01,20.9584,1,1935-11-01,1935-11-01,1935,11,Normal
01/11/1935,Vazao02,20.5037,2,1935-11-01,1935-11-02,1935,11,Normal
01/11/1935,Vazao03,18.2866,3,1935-11-01,1935-11-03,1935,11,Normal
01/11/1935,Vazao04,17.4264,4,1935-11-01,1935-11-04,1935,11,Normal
01/11/1935,Vazao05,16.5816,5,1935-11-01,1935-11-05,1935,11,Normal
01/11/1935,Vazao06,17.4264,6,1935-11-01,1935-11-06,1935,11,Normal
01/11/1935,Vazao07,39.6444,7,1935-11-01,1935-11-07,1935,11,Normal
01/11/1935,Vazao08,24.2431,8,1935-11-01,1935-11-08,1935,11,Normal
01/11/1935,Vazao09,24.2431,9,1935-11-01,1935-11-09,1935,11,Normal
01/11/1935,Vazao10,19.6056,10,1935-11-01,1935-11-10,1935,11,Normal
01/11/1935,Vazao11,17.4264,11,1935-11-01,1935-11-11,1935,11,Normal
01/11/1935,Vazao12,17.002,12,1935-11-01,1935-11-12,1935,11,Normal
01/11/1935,Vazao13,20.9584,13,1935-11-01,1935-11-13,1935,11,Normal
01/11/1935,Vazao14,22.8136,14,1935-11-01,1935-11-14,1935,11,Normal
01/11/1935,Vazao15,20.0528,15,1935-11-01,1935-11-15,1935,11,Normal
01/11/1935,Vazao16,18.2866,16,1935-11-01,1935-11-16,1935,11,Normal
01/11/1935,Vazao17,16.165,17,1935-11-01,1935-11-17,1935,11,Normal
01/11/1935,Vazao18,14.5387,18,1935-11-01,1935-11-18,1935,11,Normal
01/11/1935,Vazao19,13.3614,19,1935-11-01,1935-11-19,1935,11,Normal
01/11/1935,Vazao20,12.5972,20,1935-11-01,1935-11-20,1935,11,Normal
01/11/1935,Vazao21,12.5972,21,1935-11-01,1935-11-21,1935,11,Normal
01/11/1935,Vazao22,15.7525,22,1935-11-01,1935-11-22,1935,11,Normal
01/11/1935,Vazao23,12.9772,23,1935-11-01,1935-11-23,1935,11,Normal
01/11/1935,Vazao24,12.9772,24,1935-11-01,1935-11-24,1935,11,Normal
01/11/1935,Vazao25,16.5816,25,1935-11-01,1935-11-25,1935,11,Normal
01/11/1935,Vazao26,14.9393,26,1935-11-01,1935-11-26,1935,11,Normal
01/11/1935,Vazao27,22.3444,27,1935-11-01,1935-11-27,1935,11,Normal
01/11/1935,Vazao28,16.5816,28,1935-11-01,1935-11-28,1935,11,Normal
01/11/1935,Vazao29,15.7525,29,1935-11-01,1935-11-29,1935,11,Normal
01/11/1935,Vazao30,16.5816,30,1935-11-01,1935-11-30,1935,11,Normal
01/12/1935,Vazao01,20.0528,1,1935-12-01,1935-12-01,1935,12,Normal
01/12/1935,Vazao02,20.5037,2,1935-12-01,1935-12-02,1935,12,Normal
01/12/1935,Vazao03,17.8546,3,1935-12-01,1935-12-03,1935,12,Normal
01/12/1935,Vazao04,17.4264,4,1935-12-01,1935-12-04,1935,12,Normal
01/12/1935,Vazao05,15.7525,5,1935-12-01,1935-12-05,1935,12,Normal
01/12/1935,Vazao06,14.1421,6,1935-12-01,1935-12-06,1935,12,Normal
01/12/1935,Vazao07,32.9338,7,1935-12-01,1935-12-07,1935,12,Normal
01/12/1935,Vazao08,18.7225,8,1935-12-01,1935-12-08,1935,12,Normal
01/12/1935,Vazao09,18.2866,9,1935-12-01,1935-12-09,1935,12,Normal
01/12/1935,Vazao10,20.0528,10,1935-12-01,1935-12-10,1935,12,Normal
01/12/1935,Vazao11,39.0677,11,1935-12-01,1935-12-11,1935,12,Normal
01/12/1935,Vazao12,27.1974,12,1935-12-01,1935-12-12,1935,12,Normal
01/12/1935,Vazao13,23.2865,13,1935-12-01,1935-12-13,1935,12,Normal
01/12/1935,Vazao14,24.2431,14,1935-12-01,1935-12-14,1935,12,Normal
01/12/1935,Vazao15,34.02,15,1935-12-01,1935-12-15,1935,12,Normal
01/12/1935,Vazao16,37.9237,16,1935-12-01,1935-12-16,1935,12,Normal
01/12/1935,Vazao17,30.8008,17,1935-12-01,1935-12-17,1935,12,Normal
01/12/1935,Vazao18,28.7213,18,1935-12-01,1935-12-18,1935,12,Normal
01/12/1935,Vazao19,26.1986,19,1935-12-01,1935-12-19,1935,12,Normal
01/12/1935,Vazao20,22.3444,20,1935-12-01,1935-12-20,1935,12,Normal
01/12/1935,Vazao21,20.5037,21,1935-12-01,1935-12-21,1935,12,Normal
01/12/1935,Vazao22,18.7225,22,1935-12-01,1935-12-22,1935,12,Normal
01/12/1935,Vazao23,17.002,23,1935-12-01,1935-12-23,1935,12,Normal
01/12/1935,Vazao24,16.5816,24,1935-12-01,1935-12-24,1935,12,Normal
01/12/1935,Vazao25,15.7525,25,1935-12-01,1935-12-25,1935,12,Normal
01/12/1935,Vazao26,14.5387,26,1935-12-01,1935-12-26,1935,12,Normal
01/12/1935,Vazao27,13.3614,27,1935-12-01,1935-12-27,1935,12,Normal
01/12/1935,Vazao28,12.5972,28,1935-12-01,1935-12-28,1935,12,Normal
01/12/1935,Vazao29,16.165,29,1935-12-01,1935-12-29,1935,12,Normal
01/12/1935,Vazao30,26.6963,30,1935-12-01,1935-12-30,1935,12,Normal
01/12/1935,Vazao31,26.1986,31,1935-12-01,1935-12-31,1935,12,Normal
01/01/1936,Vazao01,23.2865,1,1936-01-01,1936-01-01,1936,1,Normal
01/01/1936,Vazao02,28.2099,2,1936-01-01,1936-01-02,1936,1,Normal
01/01/1936,Vazao03,38.4941,3,1936-01-01,1936-01-03,1936,1,Normal
01/01/1936,Vazao04,30.8008,4,1936-01-01,1936-01-04,1936,1,Normal
01/01/1936,Vazao05,30.2759,5,1936-01-01,1936-01-05,1936,1,Normal
01/01/1936,Vazao06,29.2361,6,1936-01-01,1936-01-06,1936,1,Normal
01/01/1936,Vazao07,21.8787,7,1936-01-01,1936-01-07,1936,1,Normal
01/01/1936,Vazao08,20.5037,8,1936-01-01,1936-01-08,1936,1,Normal
01/01/1936,Vazao09,17.4264,9,1936-01-01,1936-01-09,1936,1,Normal
01/01/1936,Vazao10,15.7525,10,1936-01-01,1936-01-10,1936,1,Normal
01/01/1936,Vazao11,15.7525,11,1936-01-01,1936-01-11,1936,1,Normal
01/01/1936,Vazao12,12.2214,12,1936-01-01,1936-01-12,1936,1,Normal
01/01/1936,Vazao13,18.7225,13,1936-01-01,1936-01-13,1936,1,Normal
01/01/1936,Vazao14,22.8136,14,1936-01-01,1936-01-14,1936,1,Normal
01/01/1936,Vazao15,21.8787,15,1936-01-01,1936-01-15,1936,1,Normal
01/01/1936,Vazao16,19.6056,16,1936-01-01,1936-01-16,1936,1,Normal
01/01/1936,Vazao17,17.4264,17,1936-01-01,1936-01-17,1936,1,Normal
01/01/1936,Vazao18,17.8546,18,1936-01-01,1936-01-18,1936,1,Normal
01/01/1936,Vazao19,39.6444,19,1936-01-01,1936-01-19,1936,1,Normal
01/01/1936,Vazao20,29.7543,20,1936-01-01,1936-01-20,1936,1,Normal
01/01/1936,Vazao21,28.2099,21,1936-01-01,1936-01-21,1936,1,Normal
01/01/1936,Vazao22,23.763,22,1936-01-01,1936-01-22,1936,1,Normal
01/01/1936,Vazao23,20.5037,23,1936-01-01,1936-01-23,1936,1,Normal
01/01/1936,Vazao24,17.8546,24,1936-01-01,1936-01-24,1936,1,Normal
01/01/1936,Vazao25,15.7525,25,1936-01-01,1936-01-25,1936,1,Normal
01/01/1936,Vazao26,14.1421,26,1936-01-01,1936-01-26,1936,1,Normal
01/01/1936,Vazao27,13.3614,27,1936-01-01,1936-01-27,1936,1,Normal
01/01/1936,Vazao28,12.5972,28,1936-01-01,1936-01-28,1936,1,Normal
01/01/1936,Vazao29,12.5972,29,1936-01-01,1936-01-29,1936,1,Normal
01/01/1936,Vazao30,11.8498,30,1936-01-01,1936-01-30,1936,1,Normal
01/01/1936,Vazao31,11.1195,31,1936-01-01,1936-01-31,1936,1,Normal
01/02/1936,Vazao01,10.4066,1,1936-02-01,1936-02-01,1936,2,Normal
01/02/1936,Vazao02,10.4066,2,1936-02-01,1936-02-02,1936,2,Normal
01/02/1936,Vazao03,11.1195,3,1936-02-01,1936-02-03,1936,2,Normal
01/02/1936,Vazao04,13.3614,4,1936-02-01,1936-02-04,1936,2,Normal
01/02/1936,Vazao05,26.1986,5,1936-02-01,1936-02-05,1936,2,Normal
01/02/1936,Vazao06,7.7351,6,1936-02-01,1936-02-06,1936,2,Seca
01/02/1936,Vazao07,44.37,7,1936-02-01,1936-02-07,1936,2,Normal
01/02/1936,Vazao08,31.8607,8,1936-02-01,1936-02-08,1936,2,Normal
01/02/1936,Vazao09,32.9338,9,1936-02-01,1936-02-09,1936,2,Normal
01/02/1936,Vazao10,29.2361,10,1936-02-01,1936-02-10,1936,2,Normal
01/02/1936,Vazao11,20.9584,11,1936-02-01,1936-02-11,1936,2,Normal
01/02/1936,Vazao12,19.1622,12,1936-02-01,1936-02-12,1936,2,Normal
01/02/1936,Vazao13,17.002,13,1936-02-01,1936-02-13,1936,2,Normal
01/02/1936,Vazao14,20.5037,14,1936-02-01,1936-02-14,1936,2,Normal
01/02/1936,Vazao15,18.7225,15,1936-02-01,1936-02-15,1936,2,Normal
01/02/1936,Vazao16,16.5816,16,1936-02-01,1936-02-16,1936,2,Normal
01/02/1936,Vazao17,14.5387,17,1936-02-01,1936-02-17,1936,2,Normal
01/02/1936,Vazao18,14.1421,18,1936-02-01,1936-02-18,1936,2,Normal
01/02/1936,Vazao19,16.165,19,1936-02-01,1936-02-19,1936,2,Normal
01/02/1936,Vazao20,22.8136,20,1936-02-01,1936-02-20,1936,2,Normal
01/02/1936,Vazao21,22.3444,21,1936-02-01,1936-02-21,1936,2,Normal
01/02/1936,Vazao22,24.2431,22,1936-02-01,1936-02-22,1936,2,Normal
01/02/1936,Vazao23,39.0677,23,1936-02-01,1936-02-23,1936,2,Normal
01/02/1936,Vazao24,36.7923,24,1936-02-01,1936-02-24,1936,2,Normal
01/02/1936,Vazao25,35.1193,25,1936-02-01,1936-02-25,1936,2,Normal
01/02/1936,Vazao26,93.4915,26,1936-02-01,1936-02-26,1936,2,Cheia
01/02/1936,Vazao27,88.6645,27,1936-02-01,1936-02-27,1936,2,Cheia
01/02/1936,Vazao28,105.4053,28,1936-02-01,1936-02-28,1936,2,Cheia
01/02/1936,Vazao29,117.2694,29,1936-02-01,1936-02-29,1936,2,Cheia
01/03/1936,Vazao01,115.9237,1,1936-03-01,1936-03-01,1936,3,Cheia
01/03/1936,Vazao02,78.7838,2,1936-03-01,1936-03-02,1936,3,Normal
01/03/1936,Vazao03,64.4749,3,1936-03-01,1936-03-03,1936,3,Normal
01/03/1936,Vazao04,60.3688,4,1936-03-01,1936-03-04,1936,3,Normal
01/03/1936,Vazao05,60.3688,5,1936-03-01,1936-03-05,1936,3,Normal
01/03/1936,Vazao06,61.0462,6,1936-03-01,1936-03-06,1936,3,Normal
01/03/1936,Vazao07,61.0462,7,1936-03-01,1936-03-07,1936,3,Normal
01/03/1936,Vazao08,61.0462,8,1936-03-01,1936-03-08,1936,3,Normal
01/03/1936,Vazao09,59.0225,9,1936-03-01,1936-03-09,1936,3,Normal
01/03/1936,Vazao10,61.0462,10,1936-03-01,1936-03-10,1936,3,Normal
01/03/1936,Vazao11,46.8062,11,1936-03-01,1936-03-11,1936,3,Normal
01/03/1936,Vazao12,43.1702,12,1936-03-01,1936-03-12,1936,3,Normal
01/03/1936,Vazao13,40.8073,13,1936-03-01,1936-03-13,1936,3,Normal
01/03/1936,Vazao14,35.1193,14,1936-03-01,1936-03-14,1936,3,Normal
01/03/1936,Vazao15,64.4749,15,1936-03-01,1936-03-15,1936,3,Normal
01/03/1936,Vazao16,54.3999,16,1936-03-01,1936-03-16,1936,3,Normal
01/03/1936,Vazao17,64.4749,17,1936-03-01,1936-03-17,1936,3,Normal
01/03/1936,Vazao18,53.105,18,1936-03-01,1936-03-18,1936,3,Normal
01/03/1936,Vazao19,48.0423,19,1936-03-01,1936-03-19,1936,3,Normal
01/03/1936,Vazao20,48.6648,20,1936-03-01,1936-03-20,1936,3,Normal
01/03/1936,Vazao21,48.6648,21,1936-03-01,1936-03-21,1936,3,Normal
01/03/1936,Vazao22,46.1926,22,1936-03-01,1936-03-22,1936,3,Normal
01/03/1936,Vazao23,49.2903,23,1936-03-01,1936-03-23,1936,3,Normal
01/03/1936,Vazao24,44.9745,24,1936-03-01,1936-03-24,1936,3,Normal
01/03/1936,Vazao25,41.3934,25,1936-03-01,1936-03-25,1936,3,Normal
01/03/1936,Vazao26,38.4941,26,1936-03-01,1936-03-26,1936,3,Normal
01/03/1936,Vazao27,43.7686,27,1936-03-01,1936-03-27,1936,3,Normal
01/03/1936,Vazao28,48.0423,28,1936-03-01,1936-03-28,1936,3,Normal
01/03/1936,Vazao29,48.0423,29,1936-03-01,1936-03-29,1936,3,Normal
01/03/1936,Vazao30,51.1845,30,1936-03-01,1936-03-30,1936,3,Normal
01/03/1936,Vazao31,51.1845,31,1936-03-01,1936-03-31,1936,3,Normal
01/04/1936,Vazao01,41.9826,1,1936-04-01,1936-04-01,1936,4,Normal
01/04/1936,Vazao02,39.0677,2,1936-04-01,1936-04-02,1936,4,Normal
01/04/1936,Vazao03,32.9338,3,1936-04-01,1936-04-03,1936,4,Normal
01/04/1936,Vazao04,30.8008,4,1936-04-01,1936-04-04,1936,4,Normal
01/04/1936,Vazao05,29.7543,5,1936-04-01,1936-04-05,1936,4,Normal
01/04/1936,Vazao06,33.4752,6,1936-04-01,1936-04-06,1936,4,Normal
01/04/1936,Vazao07,28.2099,7,1936-04-01,1936-04-07,1936,4,Normal
01/04/1936,Vazao08,27.7019,8,1936-04-01,1936-04-08,1936,4,Normal
01/04/1936,Vazao09,26.6963,9,1936-04-01,1936-04-09,1936,4,Normal
01/04/1936,Vazao10,25.7045,10,1936-04-01,1936-04-10,1936,4,Normal
01/04/1936,Vazao11,25.2138,11,1936-04-01,1936-04-11,1936,4,Normal
01/04/1936,Vazao12,25.2138,12,1936-04-01,1936-04-12,1936,4,Normal
01/04/1936,Vazao13,24.7267,13,1936-04-01,1936-04-13,1936,4,Normal
01/04/1936,Vazao14,24.2431,14,1936-04-01,1936-04-14,1936,4,Normal
01/04/1936,Vazao15,23.763,15,1936-04-01,1936-04-15,1936,4,Normal
01/04/1936,Vazao16,23.2865,16,1936-04-01,1936-04-16,1936,4,Normal
01/04/1936,Vazao17,22.8136,17,1936-04-01,1936-04-17,1936,4,Normal
01/04/1936,Vazao18,22.8136,18,1936-04-01,1936-04-18,1936,4,Normal
01/04/1936,Vazao19,23.2865,19,1936-04-01,1936-04-19,1936,4,Normal
01/04/1936,Vazao20,22.8136,20,1936-04-01,1936-04-20,1936,4,Normal
01/04/1936,Vazao21,22.3444,21,1936-04-01,1936-04-21,1936,4,Normal
01/04/1936,Vazao22,23.2865,22,1936-04-01,1936-04-22,1936,4,Normal
01/04/1936,Vazao23,24.7267,23,1936-04-01,1936-04-23,1936,4,Normal
01/04/1936,Vazao24,26.1986,24,1936-04-01,1936-04-24,1936,4,Normal
01/04/1936,Vazao25,27.7019,25,1936-04-01,1936-04-25,1936,4,Normal
01/04/1936,Vazao26,26.1986,26,1936-04-01,1936-04-26,1936,4,Normal
01/04/1936,Vazao27,25.7045,27,1936-04-01,1936-04-27,1936,4,Normal
01/04/1936,Vazao28,24.7267,28,1936-04-01,1936-04-28,1936,4,Normal
01/04/1936,Vazao29,23.763,29,1936-04-01,1936-04-29,1936,4,Normal
01/04/1936,Vazao30,21.8787,30,1936-04-01,1936-04-30,1936,4,Normal
01/05/1936,Vazao01,21.4167,1,1936-05-01,1936-05-01,1936,5,Normal
01/05/1936,Vazao02,48.0423,2,1936-05-01,1936-05-02,1936,5,Normal
01/05/1936,Vazao03,35.1193,3,1936-05-01,1936-05-03,1936,5,Normal
01/05/1936,Vazao04,27.7019,4,1936-05-01,1936-05-04,1936,5,Normal
01/05/1936,Vazao05,24.2431,5,1936-05-01,1936-05-05,1936,5,Normal
01/05/1936,Vazao06,24.2431,6,1936-05-01,1936-05-06,1936,5,Normal
01/05/1936,Vazao07,21.8787,7,1936-05-01,1936-05-07,1936,5,Normal
01/05/1936,Vazao08,20.9584,8,1936-05-01,1936-05-08,1936,5,Normal
01/05/1936,Vazao09,20.9584,9,1936-05-01,1936-05-09,1936,5,Normal
01/05/1936,Vazao10,20.5037,10,1936-05-01,1936-05-10,1936,5,Normal
01/05/1936,Vazao11,19.6056,11,1936-05-01,1936-05-11,1936,5,Normal
01/05/1936,Vazao12,19.6056,12,1936-05-01,1936-05-12,1936,5,Normal
01/05/1936,Vazao13,19.6056,13,1936-05-01,1936-05-13,1936,5,Normal
01/05/1936,Vazao14,19.6056,14,1936-05-01,1936-05-14,1936,5,Normal
01/05/1936,Vazao15,19.1622,15,1936-05-01,1936-05-15,1936,5,Normal
01/05/1936,Vazao16,18.2866,16,1936-05-01,1936-05-16,1936,5,Normal
01/05/1936,Vazao17,18.2866,17,1936-05-01,1936-05-17,1936,5,Normal
01/05/1936,Vazao18,18.2866,18,1936-05-01,1936-05-18,1936,5,Normal
01/05/1936,Vazao19,18.2866,19,1936-05-01,1936-05-19,1936,5,Normal
01/05/1936,Vazao20,17.8546,20,1936-05-01,1936-05-20,1936,5,Normal
01/05/1936,Vazao21,17.4264,21,1936-05-01,1936-05-21,1936,5,Normal
01/05/1936,Vazao22,17.4264,22,1936-05-01,1936-05-22,1936,5,Normal
01/05/1936,Vazao23,17.002,23,1936-05-01,1936-05-23,1936,5,Normal
01/05/1936,Vazao24,17.002,24,1936-05-01,1936-05-24,1936,5,Normal
01/05/1936,Vazao25,16.5816,25,1936-05-01,1936-05-25,1936,5,Normal
01/05/1936,Vazao26,16.5816,26,1936-05-01,1936-05-26,1936,5,Normal
01/05/1936,Vazao27,16.165,27,1936-05-01,1936-05-27,1936,5,Normal
01/05/1936,Vazao28,16.165,28,1936-05-01,1936-05-28,1936,5,Normal
01/05/1936,Vazao29,15.7525,29,1936-05-01,1936-05-29,1936,5,Normal
01/05/1936,Vazao30,15.3439,30,1936-05-01,1936-05-30,1936,5,Normal
01/05/1936,Vazao31,15.3439,31,1936-05-01,1936-05-31,1936,5,Normal
01/06/1936,Vazao01,15.3439,1,1936-06-01,1936-06-01,1936,6,Normal
01/06/1936,Vazao02,15.3439,2,1936-06-01,1936-06-02,1936,6,Normal
01/06/1936,Vazao03,14.9393,3,1936-06-01,1936-06-03,1936,6,Normal
01/06/1936,Vazao04,14.9393,4,1936-06-01,1936-06-04,1936,6,Normal
01/06/1936,Vazao05,14.9393,5,1936-06-01,1936-06-05,1936,6,Normal
01/06/1936,Vazao06,14.9393,6,1936-06-01,1936-06-06,1936,6,Normal
01/06/1936,Vazao07,14.9393,7,1936-06-01,1936-06-07,1936,6,Normal
01/06/1936,Vazao08,14.9393,8,1936-06-01,1936-06-08,1936,6,Normal
01/06/1936,Vazao09,14.9393,9,1936-06-01,1936-06-09,1936,6,Normal
01/06/1936,Vazao10,14.5387,10,1936-06-01,1936-06-10,1936,6,Normal
01/06/1936,Vazao11,14.1421,11,1936-06-01,1936-06-11,1936,6,Normal
01/06/1936,Vazao12,14.1421,12,1936-06-01,1936-06-12,1936,6,Normal
01/06/1936,Vazao13,13.7497,13,1936-06-01,1936-06-13,1936,6,Normal
01/06/1936,Vazao14,13.3614,14,1936-06-01,1936-06-14,1936,6,Normal
01/06/1936,Vazao15,13.3614,15,1936-06-01,1936-06-15,1936,6,Normal
01/06/1936,Vazao16,12.9772,16,1936-06-01,1936-06-16,1936,6,Normal
01/06/1936,Vazao17,12.9772,17,1936-06-01,1936-06-17,1936,6,Normal
01/06/1936,Vazao18,12.9772,18,1936-06-01,1936-06-18,1936,6,Normal
01/06/1936,Vazao19,12.9772,19,1936-06-01,1936-06-19,1936,6,Normal
01/06/1936,Vazao20,12.5972,20,1936-06-01,1936-06-20,1936,6,Normal
01/06/1936,Vazao21,12.5972,21,1936-06-01,1936-06-21,1936,6,Normal
01/06/1936,Vazao22,12.5972,22,1936-06-01,1936-06-22,1936,6,Normal
01/06/1936,Vazao23,12.5972,23,1936-06-01,1936-06-23,1936,6,Normal
01/06/1936,Vazao24,12.5972,24,1936-06-01,1936-06-24,1936,6,Normal
01/06/1936,Vazao25,12.5972,25,1936-06-01,1936-06-25,1936,6,Normal
01/06/1936,Vazao26,12.5972,26,1936-06-01,1936-06-26,1936,6,Normal
01/06/1936,Vazao27,12.5972,27,1936-06-01,1936-06-27,1936,6,Normal
01/06/1936,Vazao28,12.5972,28,1936-06-01,1936-06-28,1936,6,Normal
01/06/1936,Vazao29,12.5972,29,1936-06-01,1936-06-29,1936,6,Normal
01/06/1936,Vazao30,12.2214,30,1936-06-01,1936-06-30,1936,6,Normal
01/07/1936,Vazao01,12.2214,1,1936-07-01,1936-07-01,1936,7,Normal
01/07/1936,Vazao02,11.8498,2,1936-07-01,1936-07-02,1936,7,Normal
01/07/1936,Vazao03,11.8498,3,1936-07-01,1936-07-03,1936,7,Normal
01/07/1936,Vazao04,11.8498,4,1936-07-01,1936-07-04,1936,7,Normal
01/07/1936,Vazao05,11.4825,5,1936-07-01,1936-07-05,1936,7,Normal
01/07/1936,Vazao06,11.4825,6,1936-07-01,1936-07-06,1936,7,Normal
01/07/1936,Vazao07,11.4825,7,1936-07-01,1936-07-07,1936,7,Normal
01/07/1936,Vazao08,11.4825,8,1936-07-01,1936-07-08,1936,7,Normal
01/07/1936,Vazao09,11.4825,9,1936-07-01,1936-07-09,1936,7,Normal
01/07/1936,Vazao10,11.4825,10,1936-07-01,1936-07-10,1936,7,Normal
01/07/1936,Vazao11,11.1195,11,1936-07-01,1936-07-11,1936,7,Normal
01/07/1936,Vazao12,11.1195,12,1936-07-01,1936-07-12,1936,7,Normal
01/07/1936,Vazao13,11.1195,13,1936-07-01,1936-07-13,1936,7,Normal
01/07/1936,Vazao14,11.1195,14,1936-07-01,1936-07-14,1936,7,Normal
01/07/1936,Vazao15,10.7609,15,1936-07-01,1936-07-15,1936,7,Normal
01/07/1936,Vazao16,10.7609,16,1936-07-01,1936-07-16,1936,7,Normal
01/07/1936,Vazao17,10.7609,17,1936-07-01,1936-07-17,1936,7,Normal
01/07/1936,Vazao18,10.7609,18,1936-07-01,1936-07-18,1936,7,Normal
01/07/1936,Vazao19,10.7609,19,1936-07-01,1936-07-19,1936,7,Normal
01/07/1936,Vazao20,10.7609,20,1936-07-01,1936-07-20,1936,7,Normal
01/07/1936,Vazao21,10.7609,21,1936-07-01,1936-07-21,1936,7,Normal
01/07/1936,Vazao22,10.4066,22,1936-07-01,1936-07-22,1936,7,Normal
01/07/1936,Vazao23,10.4066,23,1936-07-01,1936-07-23,1936,7,Normal
01/07/1936,Vazao24,10.4066,24,1936-07-01,1936-07-24,1936,7,Normal
01/07/1936,Vazao25,10.4066,25,1936-07-01,1936-07-25,1936,7,Normal
01/07/1936,Vazao26,11.8498,26,1936-07-01,1936-07-26,1936,7,Normal
01/07/1936,Vazao27,11.8498,27,1936-07-01,1936-07-27,1936,7,Normal
01/07/1936,Vazao28,11.8498,28,1936-07-01,1936-07-28,1936,7,Normal
01/07/1936,Vazao29,11.8498,29,1936-07-01,1936-07-29,1936,7,Normal
01/07/1936,Vazao30,11.4825,30,1936-07-01,1936-07-30,1936,7,Normal
01/07/1936,Vazao31,11.1195,31,1936-07-01,1936-07-31,1936,7,Normal
01/08/1936,Vazao01,11.1195,1,1936-08-01,1936-08-01,1936,8,Normal
01/08/1936,Vazao02,11.1195,2,1936-08-01,1936-08-02,1936,8,Normal
01/08/1936,Vazao03,11.1195,3,1936-08-01,1936-08-03,1936,8,Normal
01/08/1936,Vazao04,10.7609,4,1936-08-01,1936-08-04,1936,8,Normal
01/08/1936,Vazao05,10.7609,5,1936-08-01,1936-08-05,1936,8,Normal
01/08/1936,Vazao06,10.7609,6,1936-08-01,1936-08-06,1936,8,Normal
01/08/1936,Vazao07,10.7609,7,1936-08-01,1936-08-07,1936,8,Normal
01/08/1936,Vazao08,11.1195,8,1936-08-01,1936-08-08,1936,8,Normal
01/08/1936,Vazao09,11.1195,9,1936-08-01,1936-08-09,1936,8,Normal
01/08/1936,Vazao10,10.7609,10,1936-08-01,1936-08-10,1936,8,Normal
01/08/1936,Vazao11,10.0568,11,1936-08-01,1936-08-11,1936,8,Normal
01/08/1936,Vazao12,10.4066,12,1936-08-01,1936-08-12,1936,8,Normal
01/08/1936,Vazao13,11.1195,13,1936-08-01,1936-08-13,1936,8,Normal
01/08/1936,Vazao14,11.1195,14,1936-08-01,1936-08-14,1936,8,Normal
01/08/1936,Vazao15,12.5972,15,1936-08-01,1936-08-15,1936,8,Normal
01/08/1936,Vazao16,14.1421,16,1936-08-01,1936-08-16,1936,8,Normal
01/08/1936,Vazao17,11.8498,17,1936-08-01,1936-08-17,1936,8,Normal
01/08/1936,Vazao18,11.1195,18,1936-08-01,1936-08-18,1936,8,Normal
01/08/1936,Vazao19,11.1195,19,1936-08-01,1936-08-19,1936,8,Normal
01/08/1936,Vazao20,10.7609,20,1936-08-01,1936-08-20,1936,8,Normal
01/08/1936,Vazao21,10.7609,21,1936-08-01,1936-08-21,1936,8,Normal
01/08/1936,Vazao22,10.7609,22,1936-08-01,1936-08-22,1936,8,Normal
01/08/1936,Vazao23,11.4825,23,1936-08-01,1936-08-23,1936,8,Normal
01/08/1936,Vazao24,11.4825,24,1936-08-01,1936-08-24,1936,8,Normal
01/08/1936,Vazao25,12.5972,25,1936-08-01,1936-08-25,1936,8,Normal
01/08/1936,Vazao26,15.7525,26,1936-08-01,1936-08-26,1936,8,Normal
01/08/1936,Vazao27,20.9584,27,1936-08-01,1936-08-27,1936,8,Normal
01/08/1936,Vazao28,17.4264,28,1936-08-01,1936-08-28,1936,8,Normal
01/08/1936,Vazao29,24.7267,29,1936-08-01,1936-08-29,1936,8,Normal
01/08/1936,Vazao30,20.9584,30,1936-08-01,1936-08-30,1936,8,Normal
01/08/1936,Vazao31,19.6056,31,1936-08-01,1936-08-31,1936,8,Normal
01/09/1936,Vazao01,15.3439,1,1936-09-01,1936-09-01,1936,9,Normal
01/09/1936,Vazao02,14.9393,2,1936-09-01,1936-09-02,1936,9,Normal
01/09/1936,Vazao03,13.3614,3,1936-09-01,1936-09-03,1936,9,Normal
01/09/1936,Vazao04,12.5972,4,1936-09-01,1936-09-04,1936,9,Normal
01/09/1936,Vazao05,11.8498,5,1936-09-01,1936-09-05,1936,9,Normal
01/09/1936,Vazao06,11.8498,6,1936-09-01,1936-09-06,1936,9,Normal
01/09/1936,Vazao07,11.4825,7,1936-09-01,1936-09-07,1936,9,Normal
01/09/1936,Vazao08,11.4825,8,1936-09-01,1936-09-08,1936,9,Normal
01/09/1936,Vazao09,11.4825,9,1936-09-01,1936-09-09,1936,9,Normal
01/09/1936,Vazao10,11.1195,10,1936-09-01,1936-09-10,1936,9,Normal
01/09/1936,Vazao11,11.1195,11,1936-09-01,1936-09-11,1936,9,Normal
01/09/1936,Vazao12,25.7045,12,1936-09-01,1936-09-12,1936,9,Normal
01/09/1936,Vazao13,20.9584,13,1936-09-01,1936-09-13,1936,9,Normal
01/09/1936,Vazao14,20.0528,14,1936-09-01,1936-09-14,1936,9,Normal
01/09/1936,Vazao15,20.0528,15,1936-09-01,1936-09-15,1936,9,Normal
01/09/1936,Vazao16,20.9584,16,1936-09-01,1936-09-16,1936,9,Normal
01/09/1936,Vazao17,22.8136,17,1936-09-01,1936-09-17,1936,9,Normal
01/09/1936,Vazao18,23.763,18,1936-09-01,1936-09-18,1936,9,Normal
01/09/1936,Vazao19,20.0528,19,1936-09-01,1936-09-19,1936,9,Normal
01/09/1936,Vazao20,21.8787,20,1936-09-01,1936-09-20,1936,9,Normal
01/09/1936,Vazao21,26.6963,21,1936-09-01,1936-09-21,1936,9,Normal
01/09/1936,Vazao22,18.2866,22,1936-09-01,1936-09-22,1936,9,Normal
01/09/1936,Vazao23,17.4264,23,1936-09-01,1936-09-23,1936,9,Normal
01/09/1936,Vazao24,15.7525,24,1936-09-01,1936-09-24,1936,9,Normal
01/09/1936,Vazao25,15.3439,25,1936-09-01,1936-09-25,1936,9,Normal
01/09/1936,Vazao26,14.9393,26,1936-09-01,1936-09-26,1936,9,Normal
01/09/1936,Vazao27,14.1421,27,1936-09-01,1936-09-27,1936,9,Normal
01/09/1936,Vazao28,12.5972,28,1936-09-01,1936-09-28,1936,9,Normal
01/09/1936,Vazao29,13.7497,29,1936-09-01,1936-09-29,1936,9,Normal
01/09/1936,Vazao30,14.1421,30,1936-09-01,1936-09-30,1936,9,Normal
01/10/1936,Vazao01,12.2214,1,1936-10-01,1936-10-01,1936,10,Normal
01/10/1936,Vazao02,11.8498,2,1936-10-01,1936-10-02,1936,10,Normal
01/10/1936,Vazao03,11.1195,3,1936-10-01,1936-10-03,1936,10,Normal
01/10/1936,Vazao04,10.7609,4,1936-10-01,1936-10-04,1936,10,Normal
01/10/1936,Vazao05,10.7609,5,1936-10-01,1936-10-05,1936,10,Normal
01/10/1936,Vazao06,12.5972,6,1936-10-01,1936-10-06,1936,10,Normal
01/10/1936,Vazao07,10.0568,7,1936-10-01,1936-10-07,1936,10,Normal
01/10/1936,Vazao08,9.3705,8,1936-10-01,1936-10-08,1936,10,Normal
01/10/1936,Vazao09,8.7024,9,1936-10-01,1936-10-09,1936,10,Normal
01/10/1936,Vazao10,19.1622,10,1936-10-01,1936-10-10,1936,10,Normal
01/10/1936,Vazao11,19.1622,11,1936-10-01,1936-10-11,1936,10,Normal
01/10/1936,Vazao12,16.5816,12,1936-10-01,1936-10-12,1936,10,Normal
01/10/1936,Vazao13,13.3614,13,1936-10-01,1936-10-13,1936,10,Normal
01/10/1936,Vazao14,20.0528,14,1936-10-01,1936-10-14,1936,10,Normal
01/10/1936,Vazao15,14.9393,15,1936-10-01,1936-10-15,1936,10,Normal
01/10/1936,Vazao16,12.5972,16,1936-10-01,1936-10-16,1936,10,Normal
01/10/1936,Vazao17,9.0342,17,1936-10-01,1936-10-17,1936,10,Normal
01/10/1936,Vazao18,10.0568,18,1936-10-01,1936-10-18,1936,10,Normal
01/10/1936,Vazao19,10.0568,19,1936-10-01,1936-10-19,1936,10,Normal
01/10/1936,Vazao20,9.0342,20,1936-10-01,1936-10-20,1936,10,Normal
01/10/1936,Vazao21,10.7609,21,1936-10-01,1936-10-21,1936,10,Normal
01/10/1936,Vazao22,27.1974,22,1936-10-01,1936-10-22,1936,10,Normal
01/10/1936,Vazao23,23.2865,23,1936-10-01,1936-10-23,1936,10,Normal
01/10/1936,Vazao24,17.4264,24,1936-10-01,1936-10-24,1936,10,Normal
01/10/1936,Vazao25,16.5816,25,1936-10-01,1936-10-25,1936,10,Normal
01/10/1936,Vazao26,13.3614,26,1936-10-01,1936-10-26,1936,10,Normal
01/10/1936,Vazao27,11.4825,27,1936-10-01,1936-10-27,1936,10,Normal
01/10/1936,Vazao28,10.4066,28,1936-10-01,1936-10-28,1936,10,Normal
01/10/1936,Vazao29,9.0342,29,1936-10-01,1936-10-29,1936,10,Normal
01/10/1936,Vazao30,8.7024,30,1936-10-01,1936-10-30,1936,10,Normal
01/10/1936,Vazao31,8.3753,31,1936-10-01,1936-10-31,1936,10,Seca
01/11/1936,Vazao01,8.3753,1,1936-11-01,1936-11-01,1936,11,Seca
01/11/1936,Vazao02,7.7351,2,1936-11-01,1936-11-02,1936,11,Seca
01/11/1936,Vazao03,15.7525,3,1936-11-01,1936-11-03,1936,11,Normal
01/11/1936,Vazao04,11.4825,4,1936-11-01,1936-11-04,1936,11,Normal
01/11/1936,Vazao05,17.8546,5,1936-11-01,1936-11-05,1936,11,Normal
01/11/1936,Vazao06,30.8008,6,1936-11-01,1936-11-06,1936,11,Normal
01/11/1936,Vazao07,33.4752,7,1936-11-01,1936-11-07,1936,11,Normal
01/11/1936,Vazao08,23.2865,8,1936-11-01,1936-11-08,1936,11,Normal
01/11/1936,Vazao09,16.5816,9,1936-11-01,1936-11-09,1936,11,Normal
01/11/1936,Vazao10,20.0528,10,1936-11-01,1936-11-10,1936,11,Normal
01/11/1936,Vazao11,28.7213,11,1936-11-01,1936-11-11,1936,11,Normal
01/11/1936,Vazao12,24.7267,12,1936-11-01,1936-11-12,1936,11,Normal
01/11/1936,Vazao13,24.2431,13,1936-11-01,1936-11-13,1936,11,Normal
01/11/1936,Vazao14,21.4167,14,1936-11-01,1936-11-14,1936,11,Normal
01/11/1936,Vazao15,20.5037,15,1936-11-01,1936-11-15,1936,11,Normal
01/11/1936,Vazao16,16.5816,16,1936-11-01,1936-11-16,1936,11,Normal
01/11/1936,Vazao17,12.2214,17,1936-11-01,1936-11-17,1936,11,Normal
01/11/1936,Vazao18,20.5037,18,1936-11-01,1936-11-18,1936,11,Normal
01/11/1936,Vazao19,18.7225,19,1936-11-01,1936-11-19,1936,11,Normal
01/11/1936,Vazao20,51.1845,20,1936-11-01,1936-11-20,1936,11,Normal
01/11/1936,Vazao21,70.4958,21,1936-11-01,1936-11-21,1936,11,Normal
01/11/1936,Vazao22,26.6963,22,1936-11-01,1936-11-22,1936,11,Normal
01/11/1936,Vazao23,57.6875,23,1936-11-01,1936-11-23,1936,11,Normal
01/11/1936,Vazao24,51.1845,24,1936-11-01,1936-11-24,1936,11,Normal
01/11/1936,Vazao25,32.9338,25,1936-11-01,1936-11-25,1936,11,Normal
01/11/1936,Vazao26,38.4941,26,1936-11-01,1936-11-26,1936,11,Normal
01/11/1936,Vazao27,31.8607,27,1936-11-01,1936-11-27,1936,11,Normal
01/11/1936,Vazao28,25.2138,28,1936-11-01,1936-11-28,1936,11,Normal
01/11/1936,Vazao29,21.4167,29,1936-11-01,1936-11-29,1936,11,Normal
01/11/1936,Vazao30,19.1622,30,1936-11-01,1936-11-30,1936,11,Normal
01/12/1936,Vazao01,16.5816,1,1936-12-01,1936-12-01,1936,12,Normal
01/12/1936,Vazao02,15.3439,2,1936-12-01,1936-12-02,1936,12,Normal
01/12/1936,Vazao03,14.9393,3,1936-12-01,1936-12-03,1936,12,Normal
01/12/1936,Vazao04,13.7497,4,1936-12-01,1936-12-04,1936,12,Normal
01/12/1936,Vazao05,13.3614,5,1936-12-01,1936-12-05,1936,12,Normal
01/12/1936,Vazao06,22.8136,6,1936-12-01,1936-12-06,1936,12,Normal
01/12/1936,Vazao07,43.7686,7,1936-12-01,1936-12-07,1936,12,Normal
01/12/1936,Vazao08,24.7267,8,1936-12-01,1936-12-08,1936,12,Normal
01/12/1936,Vazao09,37.9237,9,1936-12-01,1936-12-09,1936,12,Normal
01/12/1936,Vazao10,73.2133,10,1936-12-01,1936-12-10,1936,12,Normal
01/12/1936,Vazao11,47.4227,11,1936-12-01,1936-12-11,1936,12,Normal
01/12/1936,Vazao12,37.3564,12,1936-12-01,1936-12-12,1936,12,Normal
01/12/1936,Vazao13,33.4752,13,1936-12-01,1936-12-13,1936,12,Normal
01/12/1936,Vazao14,48.0423,14,1936-12-01,1936-12-14,1936,12,Normal
01/12/1936,Vazao15,75.4199,15,1936-12-01,1936-12-15,1936,12,Normal
01/12/1936,Vazao16,86.8835,16,1936-12-01,1936-12-16,1936,12,Normal
01/12/1936,Vazao17,102.8449,17,1936-12-01,1936-12-17,1936,12,Cheia
01/12/1936,Vazao18,119.3008,18,1936-12-01,1936-12-18,1936,12,Cheia
01/12/1936,Vazao19,133.2351,19,1936-12-01,1936-12-19,1936,12,Cheia
01/12/1936,Vazao20,92.8819,20,1936-12-01,1936-12-20,1936,12,Cheia
01/12/1936,Vazao21,71.5774,21,1936-12-01,1936-12-21,1936,12,Normal
01/12/1936,Vazao22,60.3688,22,1936-12-01,1936-12-22,1936,12,Normal
01/12/1936,Vazao23,46.8062,23,1936-12-01,1936-12-23,1936,12,Normal
01/12/1936,Vazao24,36.7923,24,1936-12-01,1936-12-24,1936,12,Normal
01/12/1936,Vazao25,34.568,25,1936-12-01,1936-12-25,1936,12,Normal
01/12/1936,Vazao26,30.8008,26,1936-12-01,1936-12-26,1936,12,Normal
01/12/1936,Vazao27,35.1193,27,1936-12-01,1936-12-27,1936,12,Normal
01/12/1936,Vazao28,69.9578,28,1936-12-01,1936-12-28,1936,12,Normal
01/12/1936,Vazao29,75.4199,29,1936-12-01,1936-12-29,1936,12,Normal
01/12/1936,Vazao30,97.8074,30,1936-12-01,1936-12-30,1936,12,Cheia
01/12/1936,Vazao31,138.9982,31,1936-12-01,1936-12-31,1936,12,Cheia
01/01/1937,Vazao01,60.3688,1,1937-01-01,1937-01-01,1937,1,Normal
01/01/1937,Vazao02,91.6681,2,1937-01-01,1937-01-02,1937,1,Cheia
01/01/1937,Vazao03,111.9276,3,1937-01-01,1937-01-03,1937,1,Cheia
01/01/1937,Vazao04,92.8819,4,1937-01-01,1937-01-04,1937,1,Cheia
01/01/1937,Vazao05,78.7838,5,1937-01-01,1937-01-05,1937,1,Normal
01/01/1937,Vazao06,72.6662,6,1937-01-01,1937-01-06,1937,1,Normal
01/01/1937,Vazao07,109.9528,7,1937-01-01,1937-01-07,1937,1,Cheia
01/01/1937,Vazao08,136.8244,8,1937-01-01,1937-01-08,1937,1,Cheia
01/01/1937,Vazao09,156.9293,9,1937-01-01,1937-01-09,1937,1,Cheia
01/01/1937,Vazao10,119.9814,10,1937-01-01,1937-01-10,1937,1,Cheia
01/01/1937,Vazao11,87.4754,11,1937-01-01,1937-01-11,1937,1,Normal
01/01/1937,Vazao12,84.5336,12,1937-01-01,1937-01-12,1937,1,Normal
01/01/1937,Vazao13,74.313,13,1937-01-01,1937-01-13,1937,1,Normal
01/01/1937,Vazao14,129.688,14,1937-01-01,1937-01-14,1937,1,Cheia
01/01/1937,Vazao15,119.3008,15,1937-01-01,1937-01-15,1937,1,Cheia
01/01/1937,Vazao16,127.58,16,1937-01-01,1937-01-16,1937,1,Cheia
01/01/1937,Vazao17,86.2934,17,1937-01-01,1937-01-17,1937,1,Normal
01/01/1937,Vazao18,176.6203,18,1937-01-01,1937-01-18,1937,1,Cheia
01/01/1937,Vazao19,187.2633,19,1937-01-01,1937-01-19,1937,1,Cheia
01/01/1937,Vazao20,107.9935,20,1937-01-01,1937-01-20,1937,1,Cheia
01/01/1937,Vazao21,95.3307,21,1937-01-01,1937-01-21,1937,1,Cheia
01/01/1937,Vazao22,87.4754,22,1937-01-01,1937-01-22,1937,1,Normal
01/01/1937,Vazao23,73.2133,23,1937-01-01,1937-01-23,1937,1,Normal
01/01/1937,Vazao24,67.9726,24,1937-01-01,1937-01-24,1937,1,Normal
01/01/1937,Vazao25,99.6834,25,1937-01-01,1937-01-25,1937,1,Cheia
01/01/1937,Vazao26,86.2934,26,1937-01-01,1937-01-26,1937,1,Normal
01/01/1937,Vazao27,81.0623,27,1937-01-01,1937-01-27,1937,1,Normal
01/01/1937,Vazao28,133.9496,28,1937-01-01,1937-01-28,1937,1,Cheia
01/01/1937,Vazao29,92.8819,29,1937-01-01,1937-01-29,1937,1,Cheia
01/01/1937,Vazao30,68.3545,30,1937-01-01,1937-01-30,1937,1,Normal
01/01/1937,Vazao31,54.3999,31,1937-01-01,1937-01-31,1937,1,Normal
01/02/1937,Vazao01,49.2903,1,1937-02-01,1937-02-01,1937,2,Normal
01/02/1937,Vazao02,49.2903,2,1937-02-01,1937-02-02,1937,2,Normal
01/02/1937,Vazao03,48.0423,3,1937-02-01,1937-02-03,1937,2,Normal
01/02/1937,Vazao04,46.8062,4,1937-02-01,1937-02-04,1937,2,Normal
01/02/1937,Vazao05,43.7686,5,1937-02-01,1937-02-05,1937,2,Normal
01/02/1937,Vazao06,61.7264,6,1937-02-01,1937-02-06,1937,2,Normal
01/02/1937,Vazao07,62.4093,7,1937-02-01,1937-02-07,1937,2,Normal
01/02/1937,Vazao08,68.8871,8,1937-02-01,1937-02-08,1937,2,Normal
01/02/1937,Vazao09,49.9187,9,1937-02-01,1937-02-09,1937,2,Normal
01/02/1937,Vazao10,50.5501,10,1937-02-01,1937-02-10,1937,2,Normal
01/02/1937,Vazao11,55.0517,11,1937-02-01,1937-02-11,1937,2,Normal
01/02/1937,Vazao12,71.5774,12,1937-02-01,1937-02-12,1937,2,Normal
01/02/1937,Vazao13,53.751,13,1937-02-01,1937-02-13,1937,2,Normal
01/02/1937,Vazao14,76.534,14,1937-02-01,1937-02-14,1937,2,Normal
01/02/1937,Vazao15,65.8657,15,1937-02-01,1937-02-15,1937,2,Normal
01/02/1937,Vazao16,100.9428,16,1937-02-01,1937-02-16,1937,2,Cheia
01/02/1937,Vazao17,90.4614,17,1937-02-01,1937-02-17,1937,2,Cheia
01/02/1937,Vazao18,88.069,18,1937-02-01,1937-02-18,1937,2,Normal
01/02/1937,Vazao19,80.49,19,1937-02-01,1937-02-19,1937,2,Normal
01/02/1937,Vazao20,73.2133,20,1937-02-01,1937-02-20,1937,2,Normal
01/02/1937,Vazao21,62.4093,21,1937-02-01,1937-02-21,1937,2,Normal
01/02/1937,Vazao22,52.4619,22,1937-02-01,1937-02-22,1937,2,Normal
01/02/1937,Vazao23,44.37,23,1937-02-01,1937-02-23,1937,2,Normal
01/02/1937,Vazao24,37.9237,24,1937-02-01,1937-02-24,1937,2,Normal
01/02/1937,Vazao25,37.9237,25,1937-02-01,1937-02-25,1937,2,Normal
01/02/1937,Vazao26,36.2314,26,1937-02-01,1937-02-26,1937,2,Normal
01/02/1937,Vazao27,35.1193,27,1937-02-01,1937-02-27,1937,2,Normal
01/02/1937,Vazao28,34.02,28,1937-02-01,1937-02-28,1937,2,Normal
01/03/1937,Vazao01,34.02,1,1937-03-01,1937-03-01,1937,3,Normal
01/03/1937,Vazao02,51.1845,2,1937-03-01,1937-03-02,1937,3,Normal
01/03/1937,Vazao03,73.7623,3,1937-03-01,1937-03-03,1937,3,Normal
01/03/1937,Vazao04,54.3999,4,1937-03-01,1937-03-04,1937,3,Normal
01/03/1937,Vazao05,41.9826,5,1937-03-01,1937-03-05,1937,3,Normal
01/03/1937,Vazao06,39.6444,6,1937-03-01,1937-03-06,1937,3,Normal
01/03/1937,Vazao07,40.8073,7,1937-03-01,1937-03-07,1937,3,Normal
01/03/1937,Vazao08,32.3956,8,1937-03-01,1937-03-08,1937,3,Normal
01/03/1937,Vazao09,30.8008,9,1937-03-01,1937-03-09,1937,3,Normal
01/03/1937,Vazao10,35.6737,10,1937-03-01,1937-03-10,1937,3,Normal
01/03/1937,Vazao11,32.3956,11,1937-03-01,1937-03-11,1937,3,Normal
01/03/1937,Vazao12,31.8607,12,1937-03-01,1937-03-12,1937,3,Normal
01/03/1937,Vazao13,29.7543,13,1937-03-01,1937-03-13,1937,3,Normal
01/03/1937,Vazao14,28.2099,14,1937-03-01,1937-03-14,1937,3,Normal
01/03/1937,Vazao15,26.6963,15,1937-03-01,1937-03-15,1937,3,Normal
01/03/1937,Vazao16,28.7213,16,1937-03-01,1937-03-16,1937,3,Normal
01/03/1937,Vazao17,25.7045,17,1937-03-01,1937-03-17,1937,3,Normal
01/03/1937,Vazao18,26.6963,18,1937-03-01,1937-03-18,1937,3,Normal
01/03/1937,Vazao19,31.8607,19,1937-03-01,1937-03-19,1937,3,Normal
01/03/1937,Vazao20,46.8062,20,1937-03-01,1937-03-20,1937,3,Normal
01/03/1937,Vazao21,32.3956,21,1937-03-01,1937-03-21,1937,3,Normal
01/03/1937,Vazao22,37.3564,22,1937-03-01,1937-03-22,1937,3,Normal
01/03/1937,Vazao23,43.7686,23,1937-03-01,1937-03-23,1937,3,Normal
01/03/1937,Vazao24,37.9237,24,1937-03-01,1937-03-24,1937,3,Normal
01/03/1937,Vazao25,32.3956,25,1937-03-01,1937-03-25,1937,3,Normal
01/03/1937,Vazao26,46.8062,26,1937-03-01,1937-03-26,1937,3,Normal
01/03/1937,Vazao27,40.8073,27,1937-03-01,1937-03-27,1937,3,Normal
01/03/1937,Vazao28,30.8008,28,1937-03-01,1937-03-28,1937,3,Normal
01/03/1937,Vazao29,29.7543,29,1937-03-01,1937-03-29,1937,3,Normal
01/03/1937,Vazao30,26.6963,30,1937-03-01,1937-03-30,1937,3,Normal
01/03/1937,Vazao31,25.7045,31,1937-03-01,1937-03-31,1937,3,Normal
01/04/1937,Vazao01,25.2138,1,1937-04-01,1937-04-01,1937,4,Normal
01/04/1937,Vazao02,24.7267,2,1937-04-01,1937-04-02,1937,4,Normal
01/04/1937,Vazao03,24.2431,3,1937-04-01,1937-04-03,1937,4,Normal
01/04/1937,Vazao04,23.763,4,1937-04-01,1937-04-04,1937,4,Normal
01/04/1937,Vazao05,23.2865,5,1937-04-01,1937-04-05,1937,4,Normal
01/04/1937,Vazao06,22.8136,6,1937-04-01,1937-04-06,1937,4,Normal
01/04/1937,Vazao07,32.9338,7,1937-04-01,1937-04-07,1937,4,Normal
01/04/1937,Vazao08,25.7045,8,1937-04-01,1937-04-08,1937,4,Normal
01/04/1937,Vazao09,24.7267,9,1937-04-01,1937-04-09,1937,4,Normal
01/04/1937,Vazao10,23.2865,10,1937-04-01,1937-04-10,1937,4,Normal
01/04/1937,Vazao11,23.2865,11,1937-04-01,1937-04-11,1937,4,Normal
01/04/1937,Vazao12,21.8787,12,1937-04-01,1937-04-12,1937,4,Normal
01/04/1937,Vazao13,21.4167,13,1937-04-01,1937-04-13,1937,4,Normal
01/04/1937,Vazao14,20.9584,14,1937-04-01,1937-04-14,1937,4,Normal
01/04/1937,Vazao15,20.5037,15,1937-04-01,1937-04-15,1937,4,Normal
01/04/1937,Vazao16,25.7045,16,1937-04-01,1937-04-16,1937,4,Normal
01/04/1937,Vazao17,26.6963,17,1937-04-01,1937-04-17,1937,4,Normal
01/04/1937,Vazao18,26.1986,18,1937-04-01,1937-04-18,1937,4,Normal
01/04/1937,Vazao19,24.7267,19,1937-04-01,1937-04-19,1937,4,Normal
01/04/1937,Vazao20,22.3444,20,1937-04-01,1937-04-20,1937,4,Normal
01/04/1937,Vazao21,20.9584,21,1937-04-01,1937-04-21,1937,4,Normal
01/04/1937,Vazao22,20.5037,22,1937-04-01,1937-04-22,1937,4,Normal
01/04/1937,Vazao23,25.2138,23,1937-04-01,1937-04-23,1937,4,Normal
01/04/1937,Vazao24,24.7267,24,1937-04-01,1937-04-24,1937,4,Normal
01/04/1937,Vazao25,24.2431,25,1937-04-01,1937-04-25,1937,4,Normal
01/04/1937,Vazao26,23.2865,26,1937-04-01,1937-04-26,1937,4,Normal
01/04/1937,Vazao27,22.8136,27,1937-04-01,1937-04-27,1937,4,Normal
01/04/1937,Vazao28,21.8787,28,1937-04-01,1937-04-28,1937,4,Normal
01/04/1937,Vazao29,21.4167,29,1937-04-01,1937-04-29,1937,4,Normal
01/04/1937,Vazao30,21.4167,30,1937-04-01,1937-04-30,1937,4,Normal
01/05/1937,Vazao01,24.2431,1,1937-05-01,1937-05-01,1937,5,Normal
01/05/1937,Vazao02,57.0243,2,1937-05-01,1937-05-02,1937,5,Normal
01/05/1937,Vazao03,41.9826,3,1937-05-01,1937-05-03,1937,5,Normal
01/05/1937,Vazao04,36.2314,4,1937-05-01,1937-05-04,1937,5,Normal
01/05/1937,Vazao05,28.2099,5,1937-05-01,1937-05-05,1937,5,Normal
01/05/1937,Vazao06,25.7045,6,1937-05-01,1937-05-06,1937,5,Normal
01/05/1937,Vazao07,24.7267,7,1937-05-01,1937-05-07,1937,5,Normal
01/05/1937,Vazao08,22.8136,8,1937-05-01,1937-05-08,1937,5,Normal
01/05/1937,Vazao09,21.8787,9,1937-05-01,1937-05-09,1937,5,Normal
01/05/1937,Vazao10,20.9584,10,1937-05-01,1937-05-10,1937,5,Normal
01/05/1937,Vazao11,20.5037,11,1937-05-01,1937-05-11,1937,5,Normal
01/05/1937,Vazao12,20.0528,12,1937-05-01,1937-05-12,1937,5,Normal
01/05/1937,Vazao13,19.6056,13,1937-05-01,1937-05-13,1937,5,Normal
01/05/1937,Vazao14,19.6056,14,1937-05-01,1937-05-14,1937,5,Normal
01/05/1937,Vazao15,19.6056,15,1937-05-01,1937-05-15,1937,5,Normal
01/05/1937,Vazao16,39.0677,16,1937-05-01,1937-05-16,1937,5,Normal
01/05/1937,Vazao17,41.9826,17,1937-05-01,1937-05-17,1937,5,Normal
01/05/1937,Vazao18,40.2243,18,1937-05-01,1937-05-18,1937,5,Normal
01/05/1937,Vazao19,25.7045,19,1937-05-01,1937-05-19,1937,5,Normal
01/05/1937,Vazao20,22.8136,20,1937-05-01,1937-05-20,1937,5,Normal
01/05/1937,Vazao21,20.9584,21,1937-05-01,1937-05-21,1937,5,Normal
01/05/1937,Vazao22,20.5037,22,1937-05-01,1937-05-22,1937,5,Normal
01/05/1937,Vazao23,20.5037,23,1937-05-01,1937-05-23,1937,5,Normal
01/05/1937,Vazao24,20.0528,24,1937-05-01,1937-05-24,1937,5,Normal
01/05/1937,Vazao25,20.0528,25,1937-05-01,1937-05-25,1937,5,Normal
01/05/1937,Vazao26,19.6056,26,1937-05-01,1937-05-26,1937,5,Normal
01/05/1937,Vazao27,18.7225,27,1937-05-01,1937-05-27,1937,5,Normal
01/05/1937,Vazao28,18.2866,28,1937-05-01,1937-05-28,1937,5,Normal
01/05/1937,Vazao29,18.2866,29,1937-05-01,1937-05-29,1937,5,Normal
01/05/1937,Vazao30,18.2866,30,1937-05-01,1937-05-30,1937,5,Normal
01/05/1937,Vazao31,17.8546,31,1937-05-01,1937-05-31,1937,5,Normal
01/06/1937,Vazao01,17.8546,1,1937-06-01,1937-06-01,1937,6,Normal
01/06/1937,Vazao02,25.2138,2,1937-06-01,1937-06-02,1937,6,Normal
01/06/1937,Vazao03,21.8787,3,1937-06-01,1937-06-03,1937,6,Normal
01/06/1937,Vazao04,20.9584,4,1937-06-01,1937-06-04,1937,6,Normal
01/06/1937,Vazao05,19.6056,5,1937-06-01,1937-06-05,1937,6,Normal
01/06/1937,Vazao06,18.7225,6,1937-06-01,1937-06-06,1937,6,Normal
01/06/1937,Vazao07,21.4167,7,1937-06-01,1937-06-07,1937,6,Normal
01/06/1937,Vazao08,20.9584,8,1937-06-01,1937-06-08,1937,6,Normal
01/06/1937,Vazao09,20.5037,9,1937-06-01,1937-06-09,1937,6,Normal
01/06/1937,Vazao10,19.1622,10,1937-06-01,1937-06-10,1937,6,Normal
01/06/1937,Vazao11,18.2866,11,1937-06-01,1937-06-11,1937,6,Normal
01/06/1937,Vazao12,18.2866,12,1937-06-01,1937-06-12,1937,6,Normal
01/06/1937,Vazao13,18.7225,13,1937-06-01,1937-06-13,1937,6,Normal
01/06/1937,Vazao14,17.8546,14,1937-06-01,1937-06-14,1937,6,Normal
01/06/1937,Vazao15,17.4264,15,1937-06-01,1937-06-15,1937,6,Normal
01/06/1937,Vazao16,17.002,16,1937-06-01,1937-06-16,1937,6,Normal
01/06/1937,Vazao17,17.4264,17,1937-06-01,1937-06-17,1937,6,Normal
01/06/1937,Vazao18,16.5816,18,1937-06-01,1937-06-18,1937,6,Normal
01/06/1937,Vazao19,16.165,19,1937-06-01,1937-06-19,1937,6,Normal
01/06/1937,Vazao20,16.165,20,1937-06-01,1937-06-20,1937,6,Normal
01/06/1937,Vazao21,15.7525,21,1937-06-01,1937-06-21,1937,6,Normal
01/06/1937,Vazao22,15.7525,22,1937-06-01,1937-06-22,1937,6,Normal
01/06/1937,Vazao23,15.3439,23,1937-06-01,1937-06-23,1937,6,Normal
01/06/1937,Vazao24,15.3439,24,1937-06-01,1937-06-24,1937,6,Normal
01/06/1937,Vazao25,15.3439,25,1937-06-01,1937-06-25,1937,6,Normal
01/06/1937,Vazao26,15.3439,26,1937-06-01,1937-06-26,1937,6,Normal
01/06/1937,Vazao27,14.9393,27,1937-06-01,1937-06-27,1937,6,Normal
01/06/1937,Vazao28,14.5387,28,1937-06-01,1937-06-28,1937,6,Normal
01/06/1937,Vazao29,14.5387,29,1937-06-01,1937-06-29,1937,6,Normal
01/06/1937,Vazao30,14.1421,30,1937-06-01,1937-06-30,1937,6,Normal
01/07/1937,Vazao01,14.1421,1,1937-07-01,1937-07-01,1937,7,Normal
01/07/1937,Vazao02,14.1421,2,1937-07-01,1937-07-02,1937,7,Normal
01/07/1937,Vazao03,13.7497,3,1937-07-01,1937-07-03,1937,7,Normal
01/07/1937,Vazao04,13.7497,4,1937-07-01,1937-07-04,1937,7,Normal
01/07/1937,Vazao05,13.7497,5,1937-07-01,1937-07-05,1937,7,Normal
01/07/1937,Vazao06,13.3614,6,1937-07-01,1937-07-06,1937,7,Normal
01/07/1937,Vazao07,13.3614,7,1937-07-01,1937-07-07,1937,7,Normal
01/07/1937,Vazao08,13.3614,8,1937-07-01,1937-07-08,1937,7,Normal
01/07/1937,Vazao09,12.9772,9,1937-07-01,1937-07-09,1937,7,Normal
01/07/1937,Vazao10,12.9772,10,1937-07-01,1937-07-10,1937,7,Normal
01/07/1937,Vazao11,12.9772,11,1937-07-01,1937-07-11,1937,7,Normal
01/07/1937,Vazao12,12.5972,12,1937-07-01,1937-07-12,1937,7,Normal
01/07/1937,Vazao13,12.2214,13,1937-07-01,1937-07-13,1937,7,Normal
01/07/1937,Vazao14,12.2214,14,1937-07-01,1937-07-14,1937,7,Normal
01/07/1937,Vazao15,11.8498,15,1937-07-01,1937-07-15,1937,7,Normal
01/07/1937,Vazao16,11.8498,16,1937-07-01,1937-07-16,1937,7,Normal
01/07/1937,Vazao17,11.8498,17,1937-07-01,1937-07-17,1937,7,Normal
01/07/1937,Vazao18,11.8498,18,1937-07-01,1937-07-18,1937,7,Normal
01/07/1937,Vazao19,11.8498,19,1937-07-01,1937-07-19,1937,7,Normal
01/07/1937,Vazao20,11.4825,20,1937-07-01,1937-07-20,1937,7,Normal
01/07/1937,Vazao21,11.4825,21,1937-07-01,1937-07-21,1937,7,Normal
01/07/1937,Vazao22,11.4825,22,1937-07-01,1937-07-22,1937,7,Normal
01/07/1937,Vazao23,11.4825,23,1937-07-01,1937-07-23,1937,7,Normal
01/07/1937,Vazao24,11.4825,24,1937-07-01,1937-07-24,1937,7,Normal
01/07/1937,Vazao25,11.1195,25,1937-07-01,1937-07-25,1937,7,Normal
01/07/1937,Vazao26,11.1195,26,1937-07-01,1937-07-26,1937,7,Normal
01/07/1937,Vazao27,11.1195,27,1937-07-01,1937-07-27,1937,7,Normal
01/07/1937,Vazao28,11.1195,28,1937-07-01,1937-07-28,1937,7,Normal
01/07/1937,Vazao29,11.1195,29,1937-07-01,1937-07-29,1937,7,Normal
01/07/1937,Vazao30,11.1195,30,1937-07-01,1937-07-30,1937,7,Normal
01/07/1937,Vazao31,10.7609,31,1937-07-01,1937-07-31,1937,7,Normal
01/08/1937,Vazao01,12.2214,1,1937-08-01,1937-08-01,1937,8,Normal
01/08/1937,Vazao02,12.2214,2,1937-08-01,1937-08-02,1937,8,Normal
01/08/1937,Vazao03,12.2214,3,1937-08-01,1937-08-03,1937,8,Normal
01/08/1937,Vazao04,15.7525,4,1937-08-01,1937-08-04,1937,8,Normal
01/08/1937,Vazao05,14.9393,5,1937-08-01,1937-08-05,1937,8,Normal
01/08/1937,Vazao06,14.9393,6,1937-08-01,1937-08-06,1937,8,Normal
01/08/1937,Vazao07,14.9393,7,1937-08-01,1937-08-07,1937,8,Normal
01/08/1937,Vazao08,15.7525,8,1937-08-01,1937-08-08,1937,8,Normal
01/08/1937,Vazao09,15.7525,9,1937-08-01,1937-08-09,1937,8,Normal
01/08/1937,Vazao10,15.7525,10,1937-08-01,1937-08-10,1937,8,Normal
01/08/1937,Vazao11,15.7525,11,1937-08-01,1937-08-11,1937,8,Normal
01/08/1937,Vazao12,15.7525,12,1937-08-01,1937-08-12,1937,8,Normal
01/08/1937,Vazao13,16.165,13,1937-08-01,1937-08-13,1937,8,Normal
01/08/1937,Vazao14,16.165,14,1937-08-01,1937-08-14,1937,8,Normal
01/08/1937,Vazao15,15.7525,15,1937-08-01,1937-08-15,1937,8,Normal
01/08/1937,Vazao16,15.7525,16,1937-08-01,1937-08-16,1937,8,Normal
01/08/1937,Vazao17,15.7525,17,1937-08-01,1937-08-17,1937,8,Normal
01/08/1937,Vazao18,15.7525,18,1937-08-01,1937-08-18,1937,8,Normal
01/08/1937,Vazao19,14.9393,19,1937-08-01,1937-08-19,1937,8,Normal
01/08/1937,Vazao20,14.9393,20,1937-08-01,1937-08-20,1937,8,Normal
01/08/1937,Vazao21,14.9393,21,1937-08-01,1937-08-21,1937,8,Normal
01/08/1937,Vazao22,16.165,22,1937-08-01,1937-08-22,1937,8,Normal
01/08/1937,Vazao23,15.7525,23,1937-08-01,1937-08-23,1937,8,Normal
01/08/1937,Vazao24,15.7525,24,1937-08-01,1937-08-24,1937,8,Normal
01/08/1937,Vazao25,15.3439,25,1937-08-01,1937-08-25,1937,8,Normal
01/08/1937,Vazao26,15.7525,26,1937-08-01,1937-08-26,1937,8,Normal
01/08/1937,Vazao27,15.7525,27,1937-08-01,1937-08-27,1937,8,Normal
01/08/1937,Vazao28,15.3439,28,1937-08-01,1937-08-28,1937,8,Normal
01/08/1937,Vazao29,15.7525,29,1937-08-01,1937-08-29,1937,8,Normal
01/08/1937,Vazao30,16.5816,30,1937-08-01,1937-08-30,1937,8,Normal
01/08/1937,Vazao31,16.5816,31,1937-08-01,1937-08-31,1937,8,Normal
01/09/1937,Vazao01,16.5816,1,1937-09-01,1937-09-01,1937,9,Normal
01/09/1937,Vazao02,15.7525,2,1937-09-01,1937-09-02,1937,9,Normal
01/09/1937,Vazao03,15.7525,3,1937-09-01,1937-09-03,1937,9,Normal
01/09/1937,Vazao04,15.3439,4,1937-09-01,1937-09-04,1937,9,Normal
01/09/1937,Vazao05,15.3439,5,1937-09-01,1937-09-05,1937,9,Normal
01/09/1937,Vazao06,14.9393,6,1937-09-01,1937-09-06,1937,9,Normal
01/09/1937,Vazao07,14.5387,7,1937-09-01,1937-09-07,1937,9,Normal
01/09/1937,Vazao08,14.5387,8,1937-09-01,1937-09-08,1937,9,Normal
01/09/1937,Vazao09,14.1421,9,1937-09-01,1937-09-09,1937,9,Normal
01/09/1937,Vazao10,13.7497,10,1937-09-01,1937-09-10,1937,9,Normal
01/09/1937,Vazao11,13.7497,11,1937-09-01,1937-09-11,1937,9,Normal
01/09/1937,Vazao12,14.5387,12,1937-09-01,1937-09-12,1937,9,Normal
01/09/1937,Vazao13,15.3439,13,1937-09-01,1937-09-13,1937,9,Normal
01/09/1937,Vazao14,15.3439,14,1937-09-01,1937-09-14,1937,9,Normal
01/09/1937,Vazao15,15.3439,15,1937-09-01,1937-09-15,1937,9,Normal
01/09/1937,Vazao16,15.3439,16,1937-09-01,1937-09-16,1937,9,Normal
01/09/1937,Vazao17,15.3439,17,1937-09-01,1937-09-17,1937,9,Normal
01/09/1937,Vazao18,14.5387,18,1937-09-01,1937-09-18,1937,9,Normal
01/09/1937,Vazao19,14.1421,19,1937-09-01,1937-09-19,1937,9,Normal
01/09/1937,Vazao20,13.7497,20,1937-09-01,1937-09-20,1937,9,Normal
01/09/1937,Vazao21,13.3614,21,1937-09-01,1937-09-21,1937,9,Normal
01/09/1937,Vazao22,13.3614,22,1937-09-01,1937-09-22,1937,9,Normal
01/09/1937,Vazao23,12.9772,23,1937-09-01,1937-09-23,1937,9,Normal
01/09/1937,Vazao24,12.5972,24,1937-09-01,1937-09-24,1937,9,Normal
01/09/1937,Vazao25,12.5972,25,1937-09-01,1937-09-25,1937,9,Normal
01/09/1937,Vazao26,12.5972,26,1937-09-01,1937-09-26,1937,9,Normal
01/09/1937,Vazao27,12.5972,27,1937-09-01,1937-09-27,1937,9,Normal
01/09/1937,Vazao28,11.8498,28,1937-09-01,1937-09-28,1937,9,Normal
01/09/1937,Vazao29,11.4825,29,1937-09-01,1937-09-29,1937,9,Normal
01/09/1937,Vazao30,11.1195,30,1937-09-01,1937-09-30,1937,9,Normal
01/10/1937,Vazao01,17.4264,1,1937-10-01,1937-10-01,1937,10,Normal
01/10/1937,Vazao02,29.2361,2,1937-10-01,1937-10-02,1937,10,Normal
01/10/1937,Vazao03,17.4264,3,1937-10-01,1937-10-03,1937,10,Normal
01/10/1937,Vazao04,51.8217,4,1937-10-01,1937-10-04,1937,10,Normal
01/10/1937,Vazao05,30.8008,5,1937-10-01,1937-10-05,1937,10,Normal
01/10/1937,Vazao06,39.0677,6,1937-10-01,1937-10-06,1937,10,Normal
01/10/1937,Vazao07,30.8008,7,1937-10-01,1937-10-07,1937,10,Normal
01/10/1937,Vazao08,32.3956,8,1937-10-01,1937-10-08,1937,10,Normal
01/10/1937,Vazao09,29.2361,9,1937-10-01,1937-10-09,1937,10,Normal
01/10/1937,Vazao10,21.4167,10,1937-10-01,1937-10-10,1937,10,Normal
01/10/1937,Vazao11,21.4167,11,1937-10-01,1937-10-11,1937,10,Normal
01/10/1937,Vazao12,20.9584,12,1937-10-01,1937-10-12,1937,10,Normal
01/10/1937,Vazao13,53.751,13,1937-10-01,1937-10-13,1937,10,Normal
01/10/1937,Vazao14,33.4752,14,1937-10-01,1937-10-14,1937,10,Normal
01/10/1937,Vazao15,28.7213,15,1937-10-01,1937-10-15,1937,10,Normal
01/10/1937,Vazao16,36.2314,16,1937-10-01,1937-10-16,1937,10,Normal
01/10/1937,Vazao17,32.9338,17,1937-10-01,1937-10-17,1937,10,Normal
01/10/1937,Vazao18,50.5501,18,1937-10-01,1937-10-18,1937,10,Normal
01/10/1937,Vazao19,49.2903,19,1937-10-01,1937-10-19,1937,10,Normal
01/10/1937,Vazao20,90.4614,20,1937-10-01,1937-10-20,1937,10,Cheia
01/10/1937,Vazao21,49.2903,21,1937-10-01,1937-10-21,1937,10,Normal
01/10/1937,Vazao22,43.7686,22,1937-10-01,1937-10-22,1937,10,Normal
01/10/1937,Vazao23,40.2243,23,1937-10-01,1937-10-23,1937,10,Normal
01/10/1937,Vazao24,33.4752,24,1937-10-01,1937-10-24,1937,10,Normal
01/10/1937,Vazao25,28.7213,25,1937-10-01,1937-10-25,1937,10,Normal
01/10/1937,Vazao26,27.7019,26,1937-10-01,1937-10-26,1937,10,Normal
01/10/1937,Vazao27,25.2138,27,1937-10-01,1937-10-27,1937,10,Normal
01/10/1937,Vazao28,23.2865,28,1937-10-01,1937-10-28,1937,10,Normal
01/10/1937,Vazao29,21.8787,29,1937-10-01,1937-10-29,1937,10,Normal
01/10/1937,Vazao30,21.4167,30,1937-10-01,1937-10-30,1937,10,Normal
01/10/1937,Vazao31,20.9584,31,1937-10-01,1937-10-31,1937,10,Normal
01/11/1937,Vazao01,20.5037,1,1937-11-01,1937-11-01,1937,11,Normal
01/11/1937,Vazao02,48.6648,2,1937-11-01,1937-11-02,1937,11,Normal
01/11/1937,Vazao03,50.5501,3,1937-11-01,1937-11-03,1937,11,Normal
01/11/1937,Vazao04,49.9187,4,1937-11-01,1937-11-04,1937,11,Normal
01/11/1937,Vazao05,27.7019,5,1937-11-01,1937-11-05,1937,11,Normal
01/11/1937,Vazao06,29.2361,6,1937-11-01,1937-11-06,1937,11,Normal
01/11/1937,Vazao07,25.2138,7,1937-11-01,1937-11-07,1937,11,Normal
01/11/1937,Vazao08,23.763,8,1937-11-01,1937-11-08,1937,11,Normal
01/11/1937,Vazao09,33.4752,9,1937-11-01,1937-11-09,1937,11,Normal
01/11/1937,Vazao10,32.3956,10,1937-11-01,1937-11-10,1937,11,Normal
01/11/1937,Vazao11,26.1986,11,1937-11-01,1937-11-11,1937,11,Normal
01/11/1937,Vazao12,23.763,12,1937-11-01,1937-11-12,1937,11,Normal
01/11/1937,Vazao13,22.3444,13,1937-11-01,1937-11-13,1937,11,Normal
01/11/1937,Vazao14,20.9584,14,1937-11-01,1937-11-14,1937,11,Normal
01/11/1937,Vazao15,20.9584,15,1937-11-01,1937-11-15,1937,11,Normal
01/11/1937,Vazao16,20.0528,16,1937-11-01,1937-11-16,1937,11,Normal
01/11/1937,Vazao17,20.9584,17,1937-11-01,1937-11-17,1937,11,Normal
01/11/1937,Vazao18,25.2138,18,1937-11-01,1937-11-18,1937,11,Normal
01/11/1937,Vazao19,30.8008,19,1937-11-01,1937-11-19,1937,11,Normal
01/11/1937,Vazao20,26.1986,20,1937-11-01,1937-11-20,1937,11,Normal
01/11/1937,Vazao21,23.2865,21,1937-11-01,1937-11-21,1937,11,Normal
01/11/1937,Vazao22,21.4167,22,1937-11-01,1937-11-22,1937,11,Normal
01/11/1937,Vazao23,21.4167,23,1937-11-01,1937-11-23,1937,11,Normal
01/11/1937,Vazao24,69.4216,24,1937-11-01,1937-11-24,1937,11,Normal
01/11/1937,Vazao25,63.7836,25,1937-11-01,1937-11-25,1937,11,Normal
01/11/1937,Vazao26,53.105,26,1937-11-01,1937-11-26,1937,11,Normal
01/11/1937,Vazao27,46.1926,27,1937-11-01,1937-11-27,1937,11,Normal
01/11/1937,Vazao28,40.2243,28,1937-11-01,1937-11-28,1937,11,Normal
01/11/1937,Vazao29,43.1702,29,1937-11-01,1937-11-29,1937,11,Normal
01/11/1937,Vazao30,40.2243,30,1937-11-01,1937-11-30,1937,11,Normal
01/12/1937,Vazao01,49.2903,1,1937-12-01,1937-12-01,1937,12,Normal
01/12/1937,Vazao02,33.4752,2,1937-12-01,1937-12-02,1937,12,Normal
01/12/1937,Vazao03,84.5336,3,1937-12-01,1937-12-03,1937,12,Normal
01/12/1937,Vazao04,128.281,4,1937-12-01,1937-12-04,1937,12,Cheia
01/12/1937,Vazao05,93.4915,5,1937-12-01,1937-12-05,1937,12,Cheia
01/12/1937,Vazao06,89.2617,6,1937-12-01,1937-12-06,1937,12,Cheia
01/12/1937,Vazao07,106.0498,7,1937-12-01,1937-12-07,1937,12,Cheia
01/12/1937,Vazao08,129.688,8,1937-12-01,1937-12-08,1937,12,Cheia
01/12/1937,Vazao09,109.298,9,1937-12-01,1937-12-09,1937,12,Cheia
01/12/1937,Vazao10,78.7838,10,1937-12-01,1937-12-10,1937,12,Normal
01/12/1937,Vazao11,109.298,11,1937-12-01,1937-12-11,1937,12,Cheia
01/12/1937,Vazao12,99.0563,12,1937-12-01,1937-12-12,1937,12,Cheia
01/12/1937,Vazao13,72.1209,13,1937-12-01,1937-12-13,1937,12,Normal
01/12/1937,Vazao14,67.2675,14,1937-12-01,1937-12-14,1937,12,Normal
01/12/1937,Vazao15,56.3639,15,1937-12-01,1937-12-15,1937,12,Normal
01/12/1937,Vazao16,74.313,16,1937-12-01,1937-12-16,1937,12,Normal
01/12/1937,Vazao17,67.9726,17,1937-12-01,1937-12-17,1937,12,Normal
01/12/1937,Vazao18,84.5336,18,1937-12-01,1937-12-18,1937,12,Normal
01/12/1937,Vazao19,99.6834,19,1937-12-01,1937-12-19,1937,12,Cheia
01/12/1937,Vazao20,104.7626,20,1937-12-01,1937-12-20,1937,12,Cheia
01/12/1937,Vazao21,88.069,21,1937-12-01,1937-12-21,1937,12,Normal
01/12/1937,Vazao22,91.0639,22,1937-12-01,1937-12-22,1937,12,Cheia
01/12/1937,Vazao23,76.534,23,1937-12-01,1937-12-23,1937,12,Normal
01/12/1937,Vazao24,69.9578,24,1937-12-01,1937-12-24,1937,12,Normal
01/12/1937,Vazao25,57.0243,25,1937-12-01,1937-12-25,1937,12,Normal
01/12/1937,Vazao26,53.105,26,1937-12-01,1937-12-26,1937,12,Normal
01/12/1937,Vazao27,55.7064,27,1937-12-01,1937-12-27,1937,12,Normal
01/12/1937,Vazao28,82.2123,28,1937-12-01,1937-12-28,1937,12,Normal
01/12/1937,Vazao29,71.0357,29,1937-12-01,1937-12-29,1937,12,Normal
01/12/1937,Vazao30,79.3507,30,1937-12-01,1937-12-30,1937,12,Normal
01/12/1937,Vazao31,96.5656,31,1937-12-01,1937-12-31,1937,12,Cheia
01/01/1938,Vazao01,150.0928,1,1938-01-01,1938-01-01,1938,1,Cheia
01/01/1938,Vazao02,163.8997,2,1938-01-01,1938-01-02,1938,1,Cheia
01/01/1938,Vazao03,110.6093,3,1938-01-01,1938-01-03,1938,1,Cheia
01/01/1938,Vazao04,105.4053,4,1938-01-01,1938-01-04,1938,1,Cheia
01/01/1938,Vazao05,109.298,5,1938-01-01,1938-01-05,1938,1,Cheia
01/01/1938,Vazao06,90.4614,6,1938-01-01,1938-01-06,1938,1,Cheia
01/01/1938,Vazao07,79.3507,7,1938-01-01,1938-01-07,1938,1,Normal
01/01/1938,Vazao08,84.5336,8,1938-01-01,1938-01-08,1938,1,Normal
01/01/1938,Vazao09,94.1028,9,1938-01-01,1938-01-09,1938,1,Cheia
01/01/1938,Vazao10,61.0462,10,1938-01-01,1938-01-10,1938,1,Normal
01/01/1938,Vazao11,57.0243,11,1938-01-01,1938-01-11,1938,1,Normal
01/01/1938,Vazao12,52.4619,12,1938-01-01,1938-01-12,1938,1,Normal
01/01/1938,Vazao13,47.4227,13,1938-01-01,1938-01-13,1938,1,Normal
01/01/1938,Vazao14,45.5821,14,1938-01-01,1938-01-14,1938,1,Normal
01/01/1938,Vazao15,45.5821,15,1938-01-01,1938-01-15,1938,1,Normal
01/01/1938,Vazao16,48.6648,16,1938-01-01,1938-01-16,1938,1,Normal
01/01/1938,Vazao17,63.0951,17,1938-01-01,1938-01-17,1938,1,Normal
01/01/1938,Vazao18,54.3999,18,1938-01-01,1938-01-18,1938,1,Normal
01/01/1938,Vazao19,52.4619,19,1938-01-01,1938-01-19,1938,1,Normal
01/01/1938,Vazao20,48.0423,20,1938-01-01,1938-01-20,1938,1,Normal
01/01/1938,Vazao21,45.5821,21,1938-01-01,1938-01-21,1938,1,Normal
01/01/1938,Vazao22,40.2243,22,1938-01-01,1938-01-22,1938,1,Normal
01/01/1938,Vazao23,36.7923,23,1938-01-01,1938-01-23,1938,1,Normal
01/01/1938,Vazao24,36.2314,24,1938-01-01,1938-01-24,1938,1,Normal
01/01/1938,Vazao25,35.1193,25,1938-01-01,1938-01-25,1938,1,Normal
01/01/1938,Vazao26,31.3291,26,1938-01-01,1938-01-26,1938,1,Normal
01/01/1938,Vazao27,29.7543,27,1938-01-01,1938-01-27,1938,1,Normal
01/01/1938,Vazao28,28.7213,28,1938-01-01,1938-01-28,1938,1,Normal
01/01/1938,Vazao29,30.8008,29,1938-01-01,1938-01-29,1938,1,Normal
01/01/1938,Vazao30,30.2759,30,1938-01-01,1938-01-30,1938,1,Normal
01/01/1938,Vazao31,29.7543,31,1938-01-01,1938-01-31,1938,1,Normal
01/02/1938,Vazao01,28.7213,1,1938-02-01,1938-02-01,1938,2,Normal
01/02/1938,Vazao02,28.7213,2,1938-02-01,1938-02-02,1938,2,Normal
01/02/1938,Vazao03,34.568,3,1938-02-01,1938-02-03,1938,2,Normal
01/02/1938,Vazao04,67.9726,4,1938-02-01,1938-02-04,1938,2,Normal
01/02/1938,Vazao05,35.1193,5,1938-02-01,1938-02-05,1938,2,Normal
01/02/1938,Vazao06,44.37,6,1938-02-01,1938-02-06,1938,2,Normal
01/02/1938,Vazao07,86.8835,7,1938-02-01,1938-02-07,1938,2,Normal
01/02/1938,Vazao08,88.069,8,1938-02-01,1938-02-08,1938,2,Normal
01/02/1938,Vazao09,59.6943,9,1938-02-01,1938-02-09,1938,2,Normal
01/02/1938,Vazao10,53.105,10,1938-02-01,1938-02-10,1938,2,Normal
01/02/1938,Vazao11,54.3999,11,1938-02-01,1938-02-11,1938,2,Normal
01/02/1938,Vazao12,58.3536,12,1938-02-01,1938-02-12,1938,2,Normal
01/02/1938,Vazao13,49.2903,13,1938-02-01,1938-02-13,1938,2,Normal
01/02/1938,Vazao14,46.8062,14,1938-02-01,1938-02-14,1938,2,Normal
01/02/1938,Vazao15,81.0623,15,1938-02-01,1938-02-15,1938,2,Normal
01/02/1938,Vazao16,63.7836,16,1938-02-01,1938-02-16,1938,2,Normal
01/02/1938,Vazao17,77.6553,17,1938-02-01,1938-02-17,1938,2,Normal
01/02/1938,Vazao18,131.1018,18,1938-02-01,1938-02-18,1938,2,Cheia
01/02/1938,Vazao19,112.5893,19,1938-02-01,1938-02-19,1938,2,Cheia
01/02/1938,Vazao20,75.4199,20,1938-02-01,1938-02-20,1938,2,Normal
01/02/1938,Vazao21,65.1689,21,1938-02-01,1938-02-21,1938,2,Normal
01/02/1938,Vazao22,61.0462,22,1938-02-01,1938-02-22,1938,2,Normal
01/02/1938,Vazao23,59.0225,23,1938-02-01,1938-02-23,1938,2,Normal
01/02/1938,Vazao24,66.5653,24,1938-02-01,1938-02-24,1938,2,Normal
01/02/1938,Vazao25,66.5653,25,1938-02-01,1938-02-25,1938,2,Normal
01/02/1938,Vazao26,53.751,26,1938-02-01,1938-02-26,1938,2,Normal
01/02/1938,Vazao27,52.4619,27,1938-02-01,1938-02-27,1938,2,Normal
01/02/1938,Vazao28,54.3999,28,1938-02-01,1938-02-28,1938,2,Normal
01/03/1938,Vazao01,53.105,1,1938-03-01,1938-03-01,1938,3,Normal
01/03/1938,Vazao02,84.5336,2,1938-03-01,1938-03-02,1938,3,Normal
01/03/1938,Vazao03,111.9276,3,1938-03-01,1938-03-03,1938,3,Cheia
01/03/1938,Vazao04,79.3507,4,1938-03-01,1938-03-04,1938,3,Normal
01/03/1938,Vazao05,72.6662,5,1938-03-01,1938-03-05,1938,3,Normal
01/03/1938,Vazao06,70.4958,6,1938-03-01,1938-03-06,1938,3,Normal
01/03/1938,Vazao07,62.4093,7,1938-03-01,1938-03-07,1938,3,Normal
01/03/1938,Vazao08,51.8217,8,1938-03-01,1938-03-08,1938,3,Normal
01/03/1938,Vazao09,46.1926,9,1938-03-01,1938-03-09,1938,3,Normal
01/03/1938,Vazao10,44.37,10,1938-03-01,1938-03-10,1938,3,Normal
01/03/1938,Vazao11,43.1702,11,1938-03-01,1938-03-11,1938,3,Normal
01/03/1938,Vazao12,41.9826,12,1938-03-01,1938-03-12,1938,3,Normal
01/03/1938,Vazao13,39.6444,13,1938-03-01,1938-03-13,1938,3,Normal
01/03/1938,Vazao14,39.6444,14,1938-03-01,1938-03-14,1938,3,Normal
01/03/1938,Vazao15,40.2243,15,1938-03-01,1938-03-15,1938,3,Normal
01/03/1938,Vazao16,48.0423,16,1938-03-01,1938-03-16,1938,3,Normal
01/03/1938,Vazao17,46.8062,17,1938-03-01,1938-03-17,1938,3,Normal
01/03/1938,Vazao18,51.1845,18,1938-03-01,1938-03-18,1938,3,Normal
01/03/1938,Vazao19,46.8062,19,1938-03-01,1938-03-19,1938,3,Normal
01/03/1938,Vazao20,44.37,20,1938-03-01,1938-03-20,1938,3,Normal
01/03/1938,Vazao21,41.3934,21,1938-03-01,1938-03-21,1938,3,Normal
01/03/1938,Vazao22,37.3564,22,1938-03-01,1938-03-22,1938,3,Normal
01/03/1938,Vazao23,35.6737,23,1938-03-01,1938-03-23,1938,3,Normal
01/03/1938,Vazao24,37.3564,24,1938-03-01,1938-03-24,1938,3,Normal
01/03/1938,Vazao25,41.3934,25,1938-03-01,1938-03-25,1938,3,Normal
01/03/1938,Vazao26,39.6444,26,1938-03-01,1938-03-26,1938,3,Normal
01/03/1938,Vazao27,36.2314,27,1938-03-01,1938-03-27,1938,3,Normal
01/03/1938,Vazao28,34.02,28,1938-03-01,1938-03-28,1938,3,Normal
01/03/1938,Vazao29,32.9338,29,1938-03-01,1938-03-29,1938,3,Normal
01/03/1938,Vazao30,30.8008,30,1938-03-01,1938-03-30,1938,3,Normal
01/03/1938,Vazao31,29.7543,31,1938-03-01,1938-03-31,1938,3,Normal
01/04/1938,Vazao01,29.7543,1,1938-04-01,1938-04-01,1938,4,Normal
01/04/1938,Vazao02,29.2361,2,1938-04-01,1938-04-02,1938,4,Normal
01/04/1938,Vazao03,28.7213,3,1938-04-01,1938-04-03,1938,4,Normal
01/04/1938,Vazao04,28.7213,4,1938-04-01,1938-04-04,1938,4,Normal
01/04/1938,Vazao05,54.3999,5,1938-04-01,1938-04-05,1938,4,Normal
01/04/1938,Vazao06,32.3956,6,1938-04-01,1938-04-06,1938,4,Normal
01/04/1938,Vazao07,29.7543,7,1938-04-01,1938-04-07,1938,4,Normal
01/04/1938,Vazao08,28.7213,8,1938-04-01,1938-04-08,1938,4,Normal
01/04/1938,Vazao09,27.7019,9,1938-04-01,1938-04-09,1938,4,Normal
01/04/1938,Vazao10,27.7019,10,1938-04-01,1938-04-10,1938,4,Normal
01/04/1938,Vazao11,27.7019,11,1938-04-01,1938-04-11,1938,4,Normal
